Agatha Almeida;Ab, Ad blanditiis, Alias voluptatibus illum, Architecto praesentium molestiae aliquam architecto illo quas quasi, Corporis tempora laudantium, Cupiditate ab inventore, Eligendi numquam, Est eligendi amet iusto nemo dicta exercitationem architecto, Est impedit quaerat, Excepturi quidem sequi totam tenetur iure dolorum dolorum fugit, Illo tempora maiores nemo, Incidunt illum, Labore, Maiores accusantium dolor maxime sint maxime itaque dolorum vel, Maiores blanditiis possimus optio, Maiores quia nulla nobis, Molestias iusto rem, Mollitia id tempore, Nemo eligendi sunt eveniet autem, Quas, Quas molestiae nulla quisquam minus, Sit inventore distinctio veniam accusamus corrupti
Agatha Gonçalves;Alias, Alias architecto, Assumenda, Beatae rem nesciunt est placeat iusto, Debitis fugit facere magnam nihil voluptate maiores facilis, Delectus libero earum consequuntur, Deleniti porro quia quo, Ea dolores, Eligendi praesentium, Error dolorum, Et ex optio molestias minima alias, Eum repellat qui eum perferendis incidunt, Explicabo libero accusantium magni facilis, Itaque provident explicabo delectus omnis animi, Libero maxime sed iure ut nostrum, Minima eos neque quaerat atque delectus laborum, Numquam nemo itaque, Occaecati, Sit excepturi velit similique quod, Unde blanditiis unde doloribus necessitatibus laudantium, Ut labore quisquam eveniet quasi necessitatibus, Velit nobis illum numquam libero maiores repudiandae, Voluptatem distinctio magnam mollitia maxime
Alana Santos;Architecto numquam quae tempora iste culpa, Dolore doloribus, Dolorum, Eos, Illum, Ipsa eum a minus culpa aliquam, Labore repellat aut, Magni vero, Natus ducimus fugit, Optio, Porro facere non temporibus similique, Quam cumque alias, Quasi optio, Sapiente, Tempora dolore molestiae, Vitae facere praesentium, Voluptatem iusto saepe
Alexandre da Mota;Alias, Corrupti ipsa magni quod dolore accusantium vel, Earum nihil quae perferendis, Enim labore maiores fugit eveniet similique, Eum corrupti, Eveniet, Fugit qui itaque, In at, Ipsa culpa culpa, Ipsam repudiandae corrupti error assumenda, Laborum, Maiores, Minus, Molestias repellat repellat perferendis hic accusamus at doloribus dolorem, Neque, Non laudantium aspernatur expedita nulla, Odit eligendi tempore iste, Porro est iusto sit molestias corrupti, Quas quas itaque doloremque alias hic, Qui aspernatur eligendi laudantium ab commodi, Quod cupiditate a ad consequuntur, Tempore veniam, Temporibus in quam laborum, Vel ut architecto ut, Veritatis mollitia distinctio architecto modi necessitatibus cumque beatae mollitia
Alexandre Lima;Accusamus ipsam impedit voluptatibus, Consequuntur nam quia, Corporis labore recusandae voluptatibus, Cupiditate, Delectus voluptatum cum quam possimus est quasi harum dolores, Dicta dolore neque nesciunt voluptatem deserunt magnam, Eos iste amet ex excepturi consequatur sit perferendis tenetur, Exercitationem animi placeat sint quo in nam voluptatum, Illum deserunt consequuntur accusantium voluptatem facere distinctio quisquam, Incidunt alias saepe, Ipsam, Laudantium quos dolores sunt voluptas minus quia, Maiores, Nam blanditiis, Officia, Officia repellendus eos ipsam, Officiis deserunt, Quam tempora, Quas ipsum voluptatum rem odit, Qui dicta totam ad facere, Tempora dolore molestiae, Unde unde voluptatibus, Veritatis cumque ipsum nostrum
Alice da Mata;Accusantium, Accusantium commodi praesentium praesentium, Aliquam, Aspernatur, Aspernatur, Aspernatur nisi dolores quo omnis, Atque, Cumque officiis quae reprehenderit, Dolore voluptatum nostrum, Dolores vitae aspernatur totam, Eius porro distinctio molestias, Et, Et doloribus sit saepe autem dolor, Et illum voluptates sequi maiores dicta commodi, Exercitationem veritatis est officiis, Impedit, Ipsum itaque fugiat autem adipisci nobis, Labore, Necessitatibus quis vero, Nemo, Praesentium fugit, Quaerat quas quis fugit eius doloremque, Vitae aperiam, Voluptatibus itaque placeat illum exercitationem, Voluptatum nostrum asperiores animi sit
Alice Gonçalves;Adipisci tempora natus soluta mollitia, Aliquid facere, Amet, Autem, Autem et saepe unde asperiores ea, Consequatur impedit provident qui, Deleniti quod, Deserunt provident, Dignissimos id, Dolor, Doloremque omnis molestiae eveniet atque voluptatibus, Earum, Excepturi doloremque, Expedita, Ipsam deleniti, Iusto fugiat iste occaecati consequatur pariatur eos, Labore, Maiores blanditiis libero dicta, Maiores maiores saepe, Molestias ad exercitationem quisquam deleniti sequi libero id, Nesciunt illum placeat placeat, Nostrum ex reiciendis possimus laudantium ea, Nulla amet sint mollitia, Odio odit quis cupiditate, Optio asperiores tempora voluptatum eum quos, Quod maiores omnis accusantium perspiciatis, Quos incidunt quam aperiam non numquam est maiores, Ratione veritatis reprehenderit vero quis, Rem at possimus sit repellat, Repudiandae totam maiores debitis veniam quam accusantium, Sit expedita, Sunt eius quasi facere iusto fugiat, Voluptate consequuntur, Voluptates aspernatur facere eius rerum accusantium odit nam
Amanda Moreira;At eos tempora temporibus pariatur debitis sunt, Dignissimos illo placeat, Dolorum, Error nihil reprehenderit velit fugit ab, Eveniet corporis omnis, Fuga, Fugit, Id odio temporibus, Magni quos voluptas accusamus, Minus veniam nemo deserunt, Modi, Nulla alias fugiat sit dolorem aspernatur, Odio ex laudantium tenetur harum, Placeat officiis, Porro itaque in necessitatibus beatae dolore, Quasi deleniti, Reiciendis labore quas saepe cupiditate, Sapiente quae sequi, Sed sint accusantium iste voluptatibus, Similique qui, Totam saepe facere dicta earum magnam, Vel enim molestias
Amanda Oliveira;Accusamus, Adipisci, Blanditiis modi eveniet aut impedit perspiciatis occaecati, Consequuntur nihil aut laboriosam, Deleniti cum possimus delectus, Deleniti odit, Deserunt, Dolorem reprehenderit vitae iure iure qui, Et suscipit soluta dicta in, Fuga eveniet, Fugit ipsam assumenda numquam, Hic, Hic ex architecto ex, Incidunt similique modi pariatur animi repellat, Iste soluta sint perferendis, Iure repellendus voluptatibus quo, Mollitia pariatur velit, Nam earum molestiae cum debitis officia esse, Pariatur quasi officia, Perspiciatis iusto debitis odit iusto et quidem, Provident, Qui, Quia, Quidem ipsam, Quis ad mollitia modi, Recusandae sequi nostrum deleniti, Tenetur placeat libero ratione sit consequatur, Voluptas excepturi sit nobis quam esse
Ana Beatriz Carvalho;Consequatur harum aut ut quas, Culpa labore, Debitis placeat possimus, Dolor error iste perferendis nemo, Eos, Iusto alias, Libero ex itaque sunt dolorum, Magnam adipisci consequuntur expedita, Maxime dolores odit numquam neque, Minus, Molestias, Molestias ipsa impedit officiis architecto est, Occaecati, Odit facilis, Praesentium magnam, Quae libero reiciendis repellendus repellendus quia, Quas, Quas animi porro, Quas cum provident tempore quis ex blanditiis, Quas nostrum quidem sint iure, Repudiandae velit pariatur sit adipisci consequatur aspernatur accusantium, Tenetur quisquam fugit expedita, Veritatis, Voluptatibus similique illum totam
Ana Carolina Alves;Ab, Ad illo hic autem, Amet eos ipsum quisquam rerum dolores, Beatae ex expedita, Deleniti, Doloremque, Dolores molestiae, Ea eum quo tempore explicabo aperiam hic, Eaque fugiat, Enim hic dolorum, Eos, Eos cumque, Eos cumque eligendi non mollitia, Error fugit accusamus consectetur quod, Esse at amet omnis perferendis sed amet, Ex cupiditate numquam quos aperiam vel, Iure ratione, Magnam, Molestiae neque doloremque sunt, Necessitatibus aperiam suscipit porro, Neque commodi porro suscipit reiciendis, Nisi, Non, Quas quis libero numquam laborum ullam ipsum neque nostrum, Quod ex quos ipsum libero, Quos corporis molestiae inventore fuga maiores, Repellat accusamus delectus, Reprehenderit quaerat perferendis ex consequatur voluptatum enim, Reprehenderit quidem debitis, Sapiente accusamus, Totam aut sapiente nihil dolorem quam nesciunt, Ullam, Vel accusamus ratione, Vitae, Voluptates quae voluptates cupiditate saepe, Voluptates rerum esse delectus tenetur eligendi aut, Voluptatum
Ana Carolina Ramos;Alias, Blanditiis totam necessitatibus, Culpa quam provident impedit similique quas, Cum, Cumque necessitatibus, Eius, Mollitia alias perferendis architecto, Nisi rem possimus, Optio exercitationem saepe facere quaerat, Possimus voluptate officia veritatis, Quam laudantium cupiditate perspiciatis magni laudantium laudantium blanditiis, Ratione esse vitae, Saepe, Saepe vero veniam facere minima eligendi aliquid vero iste, Similique deserunt minima quasi occaecati nihil, Sunt, Suscipit esse animi eveniet quasi modi, Tenetur doloribus laboriosam, Veritatis voluptas rerum hic numquam, Voluptas quae sapiente, Voluptates vel incidunt
Ana Clara Farias;Ad qui asperiores nostrum perferendis, Autem natus perspiciatis delectus ad ipsam, Corrupti laborum exercitationem dolorem, Dolorem ea, Ea rerum quas quibusdam dolore, Eaque quaerat, Earum earum temporibus eos excepturi temporibus, Eius, Facilis reiciendis consequuntur porro tenetur, Fuga, Id autem, Itaque, Itaque laborum tenetur, Magnam ea id qui animi illum quasi, Minus omnis non eaque quo voluptas laboriosam, Modi, Odio quaerat aliquam quidem vero, Officiis ipsam, Possimus autem vitae consectetur quibusdam quas, Praesentium sint molestiae, Quasi eos sapiente voluptates dignissimos, Quibusdam, Reprehenderit, Sapiente velit, Sit at quibusdam nobis suscipit, Soluta quae quis soluta nobis, Velit ipsum ad sed in, Vero
Ana da Conceição;A maxime consequatur ut quaerat dolorum, Animi iusto ab molestias, Aperiam, Asperiores in velit omnis culpa, Atque adipisci labore, Autem, Culpa autem, Cupiditate nisi atque facilis eius, Dolorem culpa porro ducimus, Doloribus debitis quisquam aliquam minus sequi ratione, Eligendi, Excepturi, Neque maxime, Nihil numquam blanditiis voluptate, Nostrum dicta dolore minima quasi aliquam velit, Porro, Quisquam unde atque deleniti eveniet, Recusandae, Rem error quis sequi natus a saepe eos consectetur, Repudiandae omnis voluptatem suscipit neque unde, Saepe vitae consectetur veritatis rem, Sit, Soluta alias eos, Suscipit aperiam fugiat, Voluptas deleniti exercitationem, Voluptatum
Ana Júlia Nogueira;Accusamus, Consequuntur inventore reprehenderit, Corrupti placeat, Culpa amet blanditiis, Deserunt assumenda amet nihil laborum, Dolore itaque fuga, Ea aperiam cumque occaecati dignissimos iusto, Esse, Esse nesciunt repellendus, Exercitationem nobis in laborum nam reprehenderit, Iste, Laborum, Laudantium corrupti architecto asperiores, Nostrum deleniti, Nulla molestias tempore iste soluta, Porro, Porro fuga soluta maiores, Reiciendis deserunt omnis non, Repellat iure, Sapiente facilis laborum, Sit libero velit beatae, Tempora fugit, Tempore id
Ana Júlia Rodrigues;Alias placeat temporibus soluta fugit voluptatibus fuga voluptatibus sequi, Commodi culpa veritatis, Consequatur recusandae repudiandae minus eveniet voluptatem, Corporis blanditiis unde debitis pariatur culpa, Cupiditate temporibus porro blanditiis possimus temporibus distinctio, Dicta aliquam, Ea corporis quaerat, Error perspiciatis porro molestiae alias eos sapiente sit, Fugit asperiores, Fugit delectus ab error, Illo recusandae nobis asperiores eos facere illo beatae possimus, Illum, Inventore, Inventore tempore itaque dolor tenetur labore, Ipsa accusamus quia praesentium laboriosam ab, Molestias laudantium, Nihil perspiciatis consequuntur distinctio odit, Occaecati saepe consectetur unde, Odit, Officia veritatis illo quasi illum non odio, Quaerat corporis, Quos, Repellat vero facilis minus, Sed, Sed necessitatibus quaerat nesciunt nam asperiores sequi provident, Suscipit nam, Temporibus, Ut fugit in commodi laboriosam illo fugit laboriosam atque, Vel, Velit, Vero quos
Ana Laura Cunha;Ab quis facere incidunt doloremque id, Aliquid exercitationem delectus perspiciatis, Ducimus sint illum, Ipsa alias sed quibusdam mollitia eveniet ducimus, Magni vitae facere, Minima distinctio voluptatem quam, Nesciunt ad illo, Pariatur dolorem corporis illo, Placeat voluptatum odio earum amet, Provident cupiditate accusantium rem, Quis, Voluptates consequuntur nisi sint cupiditate consectetur modi
Ana Laura da Cunha;Adipisci dolores, Corporis officia quae et voluptas expedita, Dolore accusamus error fugit voluptatibus, Dolorum, Eum eius dolores ratione eius delectus, Ex aspernatur nesciunt eaque vero distinctio repellat eum, Laudantium quisquam, Magni laborum in rerum quos, Maiores ullam nisi, Non, Nostrum ab amet sed sit debitis aspernatur, Officia, Quas corporis possimus sit sequi tempore eaque possimus, Rem illo vel repellendus, Repellendus nobis, Repudiandae, Sed inventore voluptas consequatur molestias impedit, Tempora optio dignissimos veniam assumenda, Ut, Velit, Veritatis possimus sit velit delectus odio, Vero
Ana Nunes;Aperiam, Aperiam possimus, Commodi reprehenderit, Consequuntur, Culpa, Dolore doloribus, Ducimus nisi illum voluptate, Ducimus tempore, Eaque vero, Hic deserunt, Ipsam, Maiores maiores saepe, Nobis provident sed, Non rem, Occaecati, Omnis in, Quam eos asperiores magnam, Quibusdam, Voluptatum dolore aliquam rem illum exercitationem doloremque
Ana Vitória Aragão;A tenetur enim quam dolorum, Aut, Consequuntur quam impedit iusto, Dolores doloremque eligendi libero adipisci dolorem magnam nesciunt quia, Eius, Excepturi unde nulla iste iure, Facere explicabo, Ipsa soluta sunt delectus rem, Laboriosam, Molestiae sunt illum placeat quidem consequuntur tempora, Nemo similique fugit nihil, Odio culpa velit inventore asperiores culpa, Quidem nihil animi qui quibusdam, Reprehenderit recusandae aperiam minus quis autem praesentium, Sapiente sapiente consectetur incidunt, Sint dicta deleniti sapiente et ea suscipit ipsam, Sit, Voluptatibus consequatur soluta pariatur porro
André Santos;Accusamus, Accusamus blanditiis fugiat laudantium, Accusantium sapiente et ad, Animi, Corporis fugit voluptatibus itaque doloremque quas reprehenderit itaque ea, Dicta, Ducimus, Eligendi minus qui explicabo sit voluptate sit, Et quaerat fugiat voluptas magnam, Excepturi odit odio beatae, Fugit molestiae quia soluta, Id, Id tempora officiis soluta doloribus, Iste, Iure facere quos tempora, Mollitia laborum beatae, Nostrum suscipit debitis sint, Numquam facilis reprehenderit nostrum, Sequi molestias, Temporibus vel quia ullam, Vero dicta
Antônio Cunha;Aut eum incidunt, Aut quidem iure ipsam reprehenderit, Beatae iure animi ipsam, Corrupti repudiandae nobis, Ea facilis magni quo voluptas earum reiciendis nulla, Facere beatae dolorum, Ipsum doloremque possimus omnis temporibus, Laboriosam repellendus id, Maxime molestiae ea mollitia, Molestias nulla, Nobis rem harum praesentium, Non veniam quidem hic illum inventore, Nostrum deleniti, Officiis veritatis, Omnis iste minima nam reprehenderit, Placeat odit amet vitae, Quasi atque numquam magnam eveniet veritatis, Rem aspernatur omnis, Ullam
Antônio Lopes;Architecto voluptatem adipisci, Aspernatur, Consectetur commodi, Cumque sequi, Ducimus exercitationem neque aliquam fuga quos eveniet voluptate, Ducimus molestias repellat, Eaque laborum sequi, Impedit porro corrupti soluta sed, Inventore tempore itaque dolor tenetur labore, Ipsa, Iusto hic, Libero molestias ad numquam, Neque commodi porro suscipit reiciendis, Nostrum facilis esse reprehenderit aliquid, Quas debitis debitis blanditiis pariatur, Quas molestiae nulla quisquam minus, Quis eos, Quisquam sit, Repellat esse officia provident, Soluta reprehenderit adipisci porro explicabo labore enim deserunt, Voluptatum
Arthur Ferreira;Blanditiis eveniet maxime ut tenetur earum, Cumque voluptate cumque quisquam, Dicta ratione ullam sapiente cum, Dolore odio sequi, Dolorum nostrum, Eaque minus odio, Ex error harum dignissimos soluta magni nulla, Ipsum tempora aliquid numquam, Maiores aliquam enim, Minima deleniti, Neque minus facere omnis vero voluptatem similique, Nobis ad laudantium, Odio cumque aut hic iste, Officiis, Perspiciatis, Porro quod nostrum cum, Possimus quas ex occaecati, Quia quidem qui aspernatur minus quis tempore, Quis itaque enim aspernatur aliquam pariatur, Ut perspiciatis quidem omnis rem repudiandae
Augusto Cardoso;Adipisci dolores, Aliquam neque perferendis est quia consequuntur, Cupiditate, Eaque, Earum, Enim, Esse occaecati veritatis repellendus, Fuga aliquam adipisci perferendis, Id dolor deleniti non illo, Laboriosam doloribus hic ut, Minima aut praesentium molestias delectus, Occaecati, Quaerat corporis, Repellat vero magnam id unde, Saepe sapiente sit
Augusto Duarte;Animi est perferendis, Assumenda temporibus, Blanditiis eum quod, Blanditiis nemo iste adipisci atque praesentium reprehenderit, Consectetur, Cupiditate sequi animi possimus autem placeat, Eos ex quas, Hic a voluptates eligendi sed dignissimos enim optio, In exercitationem, Iure quod magni recusandae aspernatur et numquam, Laudantium magnam aliquid labore facere, Magnam consectetur quae omnis ratione, Nemo nemo debitis, Neque commodi officiis, Perspiciatis ut quas itaque ad quidem, Quaerat doloribus ex rerum, Sit voluptatem quae voluptas perferendis, Ullam, Voluptas eius
Beatriz da Rosa;Amet eveniet reprehenderit soluta tenetur, Architecto exercitationem doloribus, Blanditiis a ex, Consequuntur animi, Dolore, Ducimus, Et rem facilis, Excepturi debitis rerum fuga, Explicabo earum, Ipsam maiores omnis dolorum accusantium, Laborum minus nobis numquam, Magnam, Magni deserunt accusantium tempora exercitationem, Natus repudiandae, Odit sed culpa sunt cumque, Quos aperiam mollitia sunt, Reiciendis molestias repellat nisi, Repudiandae quibusdam eveniet possimus ducimus magni, Suscipit magnam ducimus placeat, Tempore optio expedita iste deleniti, Tenetur, Ut natus nisi iusto, Velit sit molestiae ut dolores totam minima ipsam esse, Voluptate
Beatriz Monteiro;Commodi nihil praesentium, Consectetur suscipit, Cum quod dolore, Cumque totam quis atque, Debitis culpa officia minima aperiam, Dolor autem nobis, Dolore, Esse eveniet repudiandae, Harum, Incidunt sit, Inventore, Iusto illo, Laborum, Laborum officiis vel, Nulla, Officiis pariatur in, Ratione voluptatem consequatur, Tempore eligendi temporibus cum, Temporibus libero, Voluptate consequuntur, Voluptatum esse cumque quasi veritatis
Beatriz Ramos;Adipisci quibusdam nostrum nihil mollitia suscipit, Aperiam dolor, Cum quod dolore, Debitis harum iure temporibus laborum, Delectus molestias excepturi, Dolorum temporibus a sunt accusantium, Ea reiciendis, Enim ab nihil, Est quaerat impedit, Modi ab commodi vero totam et atque nobis, Nam, Nulla at similique, Officia asperiores nisi, Perferendis debitis dignissimos magnam minus eum, Quos delectus repellendus, Temporibus error pariatur, Veniam provident iste asperiores libero magnam officia
Benjamin da Cruz;A excepturi quidem assumenda hic, Animi, Aut error ex aliquam, Beatae iure animi ipsam, Cumque cumque quis qui maxime, Distinctio, Dolore corrupti necessitatibus officiis accusantium error animi, Facere ab nulla asperiores deleniti dolorem, Libero nobis laborum doloremque, Odio, Officiis, Omnis, Optio, Perspiciatis iusto debitis odit iusto et quidem, Provident, Recusandae, Tempora ducimus numquam magni cupiditate, Tempore soluta deserunt voluptatem accusantium officia aliquid nesciunt, Tenetur exercitationem iure ullam, Tenetur temporibus voluptate, Ut fugit in commodi laboriosam illo fugit laboriosam atque, Velit enim veritatis saepe numquam consectetur, Veniam magnam vel molestias saepe
Benício Almeida;Accusantium tempore labore laborum, Ad id a quod sunt, Atque impedit quis, Atque quis praesentium, Consequatur, Distinctio accusamus quam, Ex, Explicabo earum nam amet, Hic libero quasi error facilis harum numquam, Ipsum itaque fugiat autem adipisci nobis, Iusto eius veniam itaque sit, Laboriosam, Magnam qui recusandae odit aut, Minus cum nesciunt, Molestiae, Odit consequuntur natus numquam, Odit quidem voluptatem delectus recusandae laudantium aliquid, Officia temporibus iusto numquam numquam aspernatur natus soluta, Officiis nisi minus quidem quae, Pariatur recusandae officia, Provident reprehenderit cum, Quasi id atque, Totam necessitatibus alias, Vel eius
Benício Rocha;A, Ab magni autem veniam, Asperiores sed unde earum rerum molestiae, Atque tenetur quam vero, Autem labore labore dolorum, Autem vitae, Fugiat minima ad, Fugiat qui eos quae cum maxime corrupti, Fugit culpa temporibus quasi voluptates, Fugit voluptates atque quia placeat, Illum reprehenderit, In, Maiores repudiandae, Maxime eveniet, Nihil totam sequi, Non, Odio facere recusandae officiis, Possimus autem vitae consectetur quibusdam quas, Praesentium sint molestiae, Provident, Quidem voluptatem maxime doloremque officia fugiat repellendus, Rem illo vel repellendus, Totam quibusdam fugit dolores magni libero
Bernardo das Neves;Aliquid sunt sapiente ut rem enim, Autem, Dolor, Dolor quis doloremque eius, Dolores quis architecto, Eos, Esse fugit repudiandae, Est aliquam natus expedita debitis, Est vel quaerat magnam, Et occaecati pariatur animi distinctio dicta sit, Excepturi dolores nostrum dolore accusantium dolores voluptate iste, Laborum voluptas, Libero, Molestias, Perspiciatis, Quasi id atque, Quis ipsum non reiciendis quo accusantium, Sunt veritatis ipsa corrupti aliquam blanditiis, Tempora delectus odio minima, Temporibus harum dignissimos harum, Totam mollitia veritatis tenetur doloribus ipsum, Unde odio recusandae, Vel magnam, Veniam perspiciatis, Vitae, Voluptatem excepturi ex quae provident iste vero
Bernardo Nunes;Amet dolorum dolore consequuntur, Autem quos at adipisci veniam exercitationem voluptatem, Cum, Cupiditate fugiat deserunt iste iste, Ducimus sint illum, Ea libero quas, Enim iusto quisquam, Eum, Facere, Illo, Itaque architecto beatae, Itaque perspiciatis, Iure recusandae necessitatibus vitae molestias vel, Maiores recusandae, Nam numquam, Nesciunt veritatis, Occaecati, Odio, Quia veniam, Rem eligendi laborum, Rerum, Sequi expedita accusantium nesciunt illo deserunt dolore, Tempore id odit perspiciatis ducimus, Unde, Ut id, Voluptas dolores velit
Bianca Campos;Ab officiis dolorem, Aliquam enim consequuntur assumenda recusandae sint veritatis voluptatibus nobis, Aliquid doloremque, Aliquid exercitationem delectus perspiciatis, Amet, Consequatur minima, Eligendi eos iste praesentium rerum unde porro, Enim, Harum, Ipsa praesentium, Iure corrupti voluptas, Iusto placeat, Libero eum nulla itaque aspernatur, Minima aut accusamus molestiae voluptatum, Nesciunt facere rem maiores explicabo dolore temporibus, Nulla, Perferendis eaque, Placeat tempora aut inventore, Porro quaerat, Quidem exercitationem ipsam ab, Quos distinctio magnam, Ratione ullam, Recusandae repellendus, Sequi at sequi exercitationem voluptatum animi fugit, Suscipit mollitia et unde dolores corporis enim, Vero odit quo, Voluptas, Voluptatum commodi eligendi incidunt rem sint
Bianca da Conceição;Adipisci quasi alias veritatis at, Alias accusantium occaecati, Aspernatur assumenda illum earum facere voluptatem id repudiandae unde, Assumenda nobis ipsum animi corporis odit, Blanditiis, Ducimus expedita, Eos, Esse magni ipsum fugiat deserunt quisquam, Id quia libero deserunt vitae, Laboriosam libero doloremque magnam, Laboriosam provident ad hic, Modi excepturi omnis, Molestiae laboriosam ut in ipsa, Molestias a, Nobis repellat corrupti consequatur laudantium, Numquam, Omnis voluptatem perspiciatis id vero, Porro enim a praesentium ab placeat alias quasi sit, Quaerat quas quis fugit eius doloremque, Quo, Repellendus reiciendis, Sint ut quaerat consectetur quas maxime, Soluta, Tempore reprehenderit, Vel ipsa velit, Voluptas ab aliquam optio tempore, Voluptate nobis saepe minima, Voluptatem tenetur molestiae facere alias incidunt
Bianca Martins;Accusamus quis dicta, Amet quia corporis, Asperiores doloribus veritatis aperiam, Culpa omnis ad eos possimus, Deleniti, Dignissimos mollitia dolores, Eligendi, Expedita error soluta deserunt occaecati quae rem dolorem, Hic debitis, Id soluta illo dicta reprehenderit odio, In distinctio, Inventore quibusdam quis, Labore possimus, Magnam ad ipsum impedit eum, Magnam nihil, Possimus dolore, Reprehenderit dolore amet suscipit eveniet, Rerum debitis commodi dignissimos voluptatum, Voluptatibus magnam dolor dolores labore fugit
Bianca Nascimento;Accusantium aliquid quas, Adipisci, Amet dolorum dolore consequuntur, Aperiam cumque nam, Atque architecto, Deleniti mollitia iure, Dicta, Dignissimos nulla, Dignissimos tenetur aspernatur porro tempora, Dolores assumenda voluptatum iste quaerat, Ea porro iste quis, Error laboriosam sint molestiae minima ipsum dolorem provident fuga, Eum distinctio enim pariatur incidunt, Eveniet suscipit libero nostrum nihil eum asperiores quos, Expedita adipisci repellendus omnis quisquam, Nisi, Rem ex labore debitis, Sapiente sapiente consectetur incidunt, Tempora facilis animi sed, Tenetur itaque dolores necessitatibus quibusdam nihil, Voluptatem
Breno Cavalcanti;Commodi quidem sequi ipsum at, Dolor ab, Eius, Eius aut cum, Eos, Facere, Harum, Incidunt illum, Libero sapiente commodi minima, Magnam tempore rem ipsam aperiam, Maxime perferendis nisi reiciendis, Minus, Molestias aliquid tempore, Mollitia facilis libero quas veniam facere eligendi odio ut, Nam neque dolore, Provident provident veniam error dolore accusamus sunt, Reiciendis, Reiciendis accusantium pariatur pariatur est doloremque, Repellat iure, Repellendus animi, Saepe fugiat, Voluptatem porro maxime explicabo provident cumque, Voluptates
Breno Fogaça;Assumenda, Consequuntur voluptatem, Deserunt, Dolore, Illum, Iure sint laboriosam totam, Iusto corporis, Modi dolores eos quis, Molestiae in, Non laudantium aspernatur expedita nulla, Odit facilis, Odit voluptatem aspernatur minima, Omnis omnis quidem iure, Quibusdam magnam iste minus sit laboriosam, Quibusdam optio, Quod nam, Rerum maxime illum quibusdam dignissimos, Saepe, Sequi, Ullam itaque porro maiores
