Dr. João Lucas Novaes;Aliquam dolorem ipsum repellat, Aspernatur quo quos quae deleniti expedita, Autem quos at adipisci veniam exercitationem voluptatem, Corporis doloremque occaecati, Deleniti quidem consectetur similique ea id vero, Dicta accusamus modi quam nesciunt, Distinctio nisi placeat provident ipsum, Eius, Fugit, Illum nam rem at, Ipsam quos sequi blanditiis, Ipsum culpa doloribus veniam sunt, Nam laborum cupiditate, Neque hic esse autem iste qui deleniti, Nesciunt, Omnis nobis, Omnis sit quibusdam tempora, Perspiciatis repudiandae omnis, Porro accusamus eaque dicta doloremque, Praesentium perferendis, Quo ex praesentium eligendi error quo earum quaerat, Repellendus, Rerum debitis enim impedit aliquam tempore cum, Tempora, Tempore eligendi temporibus cum, Ullam, Unde dolor, Voluptas mollitia suscipit, Voluptas voluptates quas rem itaque molestiae, Voluptate
Dr. Lucca Ferreira;Accusantium sint, Alias, Architecto assumenda repellendus quibusdam, Consequuntur maxime sapiente non tempore eaque officia accusamus at, Deserunt architecto illum facere blanditiis tempore neque rem suscipit, Distinctio nam sint, Eaque, Earum architecto explicabo itaque, Excepturi, Expedita et et qui ad, Fuga omnis qui totam veritatis, Fugiat, Illo quod quibusdam officia placeat, Libero error facere nemo nisi praesentium, Magnam ea id qui animi illum quasi, Magnam magnam dignissimos, Nemo itaque unde vitae, Numquam quis molestias deserunt, Officia ipsa dolor perspiciatis, Possimus delectus dignissimos laboriosam magnam asperiores nisi corrupti odio, Praesentium iusto, Provident suscipit rerum voluptas, Quae dignissimos nam iure totam provident, Reiciendis quibusdam facilis earum dolorum aliquid, Repellendus fugiat ipsa, Reprehenderit debitis laboriosam qui, Sit vero ipsam deserunt nulla, Sunt quibusdam fugit commodi, Tempore eius rem optio animi doloribus, Veniam, Voluptates quae voluptates cupiditate saepe
Dr. Luigi Gomes;Aliquid voluptate odio, Aperiam voluptatem voluptatum deserunt vitae aliquid voluptas soluta, Deleniti cum possimus delectus, Doloremque, Dolores quis praesentium excepturi, Eos quasi accusantium, Fugiat qui assumenda voluptas adipisci, Hic facilis mollitia optio sapiente, Itaque provident, Laboriosam, Laborum aperiam quaerat rem nisi, Minima molestias ea asperiores quae doloremque magnam, Mollitia, Nihil quia, Numquam quis molestias deserunt, Occaecati, Omnis voluptates itaque labore veritatis, Praesentium, Quasi soluta consequatur error, Quidem corporis, Quis, Quos quos exercitationem, Ratione at facilis provident architecto, Rerum, Vitae pariatur, Voluptates
Dr. Luigi Sales;Cumque, Earum, Earum vel aliquam, Eius, Est iusto, Et assumenda consequuntur doloribus odio, Facere soluta, Fugiat itaque laboriosam ex, Molestiae ad aut, Officia veritatis illo quasi illum non odio, Quis, Quis, Rerum, Sed corrupti iusto sunt dignissimos, Ut ipsam facilis, Veritatis, Voluptatem
Dr. Marcelo Nunes;Aliquid facere, Amet commodi, Aperiam, Autem, Consectetur animi cumque dolorem corrupti quia placeat necessitatibus beatae, Consequatur impedit provident qui, Consequatur repudiandae molestias minima ipsa eaque, Debitis dicta, Dolorem, Dolores fugit consequuntur in veritatis hic aut, Enim et, Et, Eum, Fugit molestiae quia soluta, Maiores incidunt occaecati, Pariatur eius sit quod, Quisquam repudiandae optio dolore, Repellendus, Suscipit inventore nam maxime, Unde
Dr. Miguel Cardoso;Accusamus commodi similique explicabo nam, Animi doloribus illum quam, Animi tempora illum saepe assumenda omnis, Aut error ex aliquam, Blanditiis odit totam ipsam doloremque quos sed, Commodi dolorem excepturi eligendi illum, Debitis dolor eum harum nihil ipsam debitis quasi, Dolore, Dolore ea minus cupiditate nemo voluptates, Ducimus, Ea libero, Ea ratione cum exercitationem, Et ea sit laborum magnam corporis, Excepturi voluptates non aspernatur, Illum, In eveniet quae provident, Libero neque repellat commodi, Molestias nulla, Natus, Nihil, Nulla impedit laborum praesentium, Quae nam rerum culpa amet, Quia neque magni ipsum, Quis vero at omnis nemo odio, Reprehenderit sunt autem saepe hic corrupti, Sapiente nobis, Unde, Veniam quaerat eius sunt quibusdam quo eaque, Voluptates fugiat quia commodi nemo
Dr. Miguel Fogaça;Assumenda et ullam nisi, Corporis voluptate ea soluta totam quos, Deserunt illo beatae delectus alias, Dolor voluptas, Doloremque libero explicabo dolorum, Dolores perspiciatis excepturi, Eveniet nihil placeat corrupti, Ex velit dolor odio velit ad quasi ipsa, Fuga rem, Ipsum amet repellat nam quis modi, Magni nulla nesciunt, Mollitia enim, Necessitatibus doloribus, Nesciunt perferendis occaecati maiores sint, Odio accusamus eaque, Omnis iure tenetur perferendis, Perspiciatis rerum, Porro a exercitationem dolorem ea explicabo, Praesentium, Quaerat hic ipsa mollitia molestiae voluptas, Qui, Repellat, Sed, Sint, Velit, Velit veniam sapiente, Voluptatibus nulla perferendis
Dr. Otávio Farias;Ab, Autem numquam animi et explicabo esse, Deleniti earum, Dignissimos sapiente, Dolor beatae tempora, Dolores quia ut perferendis, Eius tempore quaerat ad, Excepturi repellendus omnis, Expedita illo eos voluptatibus culpa, Hic placeat distinctio, Impedit vel, Iste, Itaque provident, Iure tenetur harum repudiandae quisquam officia fugit, Molestias tenetur, Nisi molestias, Nisi quasi, Possimus aut alias dolore rem veritatis beatae eum, Provident accusantium sunt totam laudantium explicabo dicta, Quaerat, Quibusdam eos sint nisi error, Rem reiciendis, Repudiandae, Tempore fuga officia sit eos, Tenetur libero, Voluptate nostrum facere laborum maxime
Dr. Otávio Sales;Accusamus, Ad omnis maiores iste natus, Culpa, Dolorem provident magni temporibus neque maxime, Dolorum, Eaque, Eligendi distinctio fugiat repellendus quibusdam, Error consequatur architecto quas repellat nulla ad optio, Facilis iure corporis distinctio illum suscipit ducimus, Facilis libero, Hic assumenda enim voluptatem, Inventore quibusdam quis, Modi, Nesciunt laudantium consequatur, Nobis consequuntur dolore quo fugiat excepturi ipsam optio neque, Quaerat explicabo nobis, Quas, Quis ipsum non reiciendis quo accusantium, Recusandae doloribus, Reprehenderit dignissimos, Sequi
Dr. Pedro Henrique Moraes;A maiores eius, Adipisci exercitationem, Asperiores eos facilis, Cum nulla repellendus velit temporibus eius dolore, Dolor, Excepturi dignissimos, Excepturi ex tempore tempora, Facilis facere aut iusto modi labore porro, Iure, Nesciunt, Nesciunt nihil pariatur, Occaecati aperiam voluptas veritatis, Praesentium quibusdam rerum tempore, Quas optio at recusandae laudantium atque, Quibusdam eos dolorum, Quidem quae sapiente assumenda, Quo, Sapiente explicabo, Similique alias illo provident, Similique et, Sunt asperiores rerum dolorem facilis eveniet, Tempora delectus odio minima
Dr. Vitor Gabriel Farias;Ad magnam in beatae eveniet aliquid, At sapiente officiis, Corporis harum magni inventore voluptate, Corporis veritatis, Cum earum modi provident, Delectus occaecati adipisci velit, Distinctio autem laboriosam rerum consequuntur, Expedita aliquid culpa saepe, Facere consectetur, Impedit iusto debitis aspernatur dolor, Iste magnam eaque sequi tenetur, Laboriosam dolorum sint ut impedit, Laudantium, Necessitatibus, Nemo iusto qui cumque, Perferendis possimus aut, Quaerat, Reprehenderit hic at iusto debitis nostrum, Vero dicta
Dra. Agatha Monteiro;Ab magni itaque id necessitatibus corporis, Doloribus ipsa, Eos enim error labore quibusdam error maxime, Eveniet aut saepe recusandae vitae velit recusandae quis, Facere, Maiores tempore, Modi quia, Odio illum minima, Praesentium, Praesentium cum, Quae, Quas beatae sapiente velit eaque ducimus, Quidem assumenda optio, Reiciendis ratione aliquam, Repellat corporis veritatis facilis similique, Repudiandae quibusdam eveniet possimus ducimus magni, Totam, Ut molestiae aliquam, Veritatis
Dra. Bárbara Castro;Alias aliquam, Aliquam veritatis occaecati, Assumenda, At, Aut quidem iure ipsam reprehenderit, Autem accusantium, Blanditiis earum et omnis iure cupiditate fuga, Cum, Cupiditate corporis in magni, Cupiditate voluptatum porro magnam omnis, Debitis dolor eum harum nihil ipsam debitis quasi, Dignissimos, Distinctio itaque doloremque optio ipsa, Doloremque, Earum quisquam, Expedita, Fuga voluptatum eveniet at voluptas dolore, Harum ab, Incidunt nihil neque placeat eum illum mollitia, Inventore nihil dolorum, Libero maxime sed iure ut nostrum, Maxime ad aspernatur, Modi velit eos, Necessitatibus nam enim beatae vel, Quasi atque numquam magnam eveniet veritatis, Quis maxime quia blanditiis repellendus occaecati, Rem error quis sequi natus a saepe eos consectetur, Repellat aspernatur rem quidem perspiciatis excepturi, Saepe illo, Sunt voluptatem minima similique, Suscipit corporis itaque, Suscipit enim voluptas numquam, Suscipit nostrum corporis, Vel
Dra. Emanuella da Mata;Asperiores recusandae tenetur fuga nisi, Aspernatur assumenda illum earum facere voluptatem id repudiandae unde, Corrupti ullam qui consectetur ut corporis, Cum culpa adipisci, Debitis tenetur vitae excepturi, Deleniti hic dolores repellat excepturi facilis, Dolore, Ea velit fugit quidem, Enim doloremque fuga, Eos, Error quasi, Fuga ex repudiandae omnis possimus placeat a modi, Illum beatae enim qui, Ipsa praesentium, Ipsum dolorum asperiores asperiores laboriosam, Numquam, Perspiciatis odio dicta fugiat vel, Suscipit ea quasi, Veritatis tempora tempora nulla ipsa, Vero voluptatum magnam voluptatum possimus tempora cupiditate, Voluptate beatae blanditiis officiis perferendis quod, Voluptate iste illo
Dra. Heloísa Moreira;Aliquam, Aliquid, Atque impedit quis, Blanditiis nam commodi, Cumque praesentium accusamus illum mollitia voluptatum, Dicta tenetur explicabo in, Eligendi voluptates rem error, Laudantium occaecati placeat repellat amet neque accusantium amet dolor, Officia, Recusandae, Sit, Ullam iusto quas quo dolor nulla, Voluptatibus dolorem similique libero
Dra. Isis Jesus;Adipisci, Adipisci quibusdam nostrum nihil mollitia suscipit, Autem, Corrupti ex consequuntur, Cumque itaque modi esse, Eaque consequuntur consectetur sed dolorum, Eos non laborum sint, Et possimus aliquam, Harum, Ipsa maiores nemo voluptatem, Libero sunt autem, Maiores aliquid voluptates praesentium doloribus cumque corporis, Nesciunt dolorum, Nostrum adipisci laudantium iure, Officiis nisi minus quidem quae, Qui quo, Repudiandae velit pariatur sit adipisci consequatur aspernatur accusantium, Vero deserunt dolores eum, Vero nemo natus exercitationem libero, Voluptate voluptate vero, Voluptates facilis
Dra. Larissa Moura;Aliquid temporibus, Deleniti, Dolorem doloremque neque sed quas, Eum et veritatis quisquam repellendus vel optio, Impedit velit at accusamus, Ipsum veritatis aspernatur ipsum provident fuga iusto, Laborum autem, Laudantium ullam aliquam soluta perspiciatis provident, Molestiae sunt illum placeat quidem consequuntur tempora, Nostrum suscipit debitis sint, Rerum dolorum aspernatur amet totam blanditiis quaerat dicta
Dra. Lorena Rocha;Adipisci facilis, Aliquam repellendus non molestias voluptatum, Blanditiis, Corrupti, Deserunt illo beatae delectus alias, Dolorum ullam earum natus alias, Ea, Eos soluta autem nostrum, Eum quibusdam unde provident cupiditate sint, Fugit ipsam assumenda numquam, Id iste aperiam, Illo possimus quod, Impedit cumque perferendis architecto nulla corrupti atque natus, Incidunt, Inventore fugit expedita rem aut non soluta, Maxime eveniet, Praesentium, Provident quos enim, Sint, Soluta alias eos, Soluta reprehenderit nesciunt saepe, Tempore et repudiandae quisquam, Veritatis voluptas modi quibusdam suscipit atque omnis asperiores, Voluptatibus
Dra. Maria Fernanda Castro;Ad earum fugiat vero sint distinctio veritatis, Asperiores laborum, Corporis tempora laudantium, Deserunt tempore numquam hic excepturi, Earum repudiandae, Eligendi rerum culpa ex consectetur, Esse temporibus, Est iusto, Eveniet nihil placeat corrupti, Ex atque praesentium voluptatem minus, Hic nulla, Inventore id ipsa, Magnam fugiat quidem iure itaque in, Maiores accusantium dolor maxime sint maxime itaque dolorum vel, Mollitia enim, Porro delectus, Possimus reiciendis, Praesentium aliquam blanditiis quidem, Quam laudantium pariatur, Quas cupiditate molestias recusandae delectus, Quo, Reiciendis, Reiciendis assumenda magni natus, Ullam, Vel ipsum commodi saepe maxime
Dra. Maria Luiza da Rosa;A minus illo illum exercitationem rerum quas, Accusantium aliquid quas, Ad, Alias dolor amet repudiandae temporibus blanditiis, Atque sit quam atque, Blanditiis id inventore molestiae, Corporis veritatis, Debitis soluta aperiam, Dignissimos accusantium in blanditiis vitae deleniti repudiandae, Fugiat, Illo quasi, Ipsum dolorum asperiores asperiores laboriosam, Minus, Necessitatibus fuga sunt cum, Nemo minus, Nostrum odio quas porro, Occaecati, Omnis nobis, Quisquam amet deleniti libero dolorum, Quo inventore fugiat delectus quo, Recusandae ipsum iusto, Tempore alias fugiat suscipit quas explicabo nam vel, Vero, Voluptatem laborum voluptatem distinctio
Dra. Rafaela da Cruz;Commodi facere amet eveniet ipsa totam quis, Cumque soluta dicta, Delectus quae vitae dolorem voluptatibus illum, Delectus similique reiciendis, Eaque sed quis vero, Enim, Est animi commodi assumenda, Id debitis, Incidunt inventore veniam repudiandae ea ad, Libero laboriosam modi pariatur nostrum pariatur, Nemo esse debitis, Perspiciatis, Provident nemo, Quia asperiores veritatis perferendis dolores, Quidem illo, Quos rerum repudiandae numquam maiores odio quisquam, Reiciendis consequatur esse sint, Soluta molestias facere qui distinctio, Temporibus ad perferendis, Veniam amet occaecati ab esse natus, Voluptatum consectetur asperiores dolore necessitatibus amet
Eduardo da Cruz;Adipisci incidunt debitis fugit architecto, Aspernatur alias quae, Aspernatur quae enim vero, Beatae mollitia explicabo eveniet quidem, Corporis tempore praesentium adipisci, Cupiditate laudantium quas, Debitis ipsum, Eius expedita, Eligendi excepturi commodi, Eos, Impedit sit, Incidunt tempora quod eligendi, Ipsa vero, Ipsam sint atque, Iure cum, Laboriosam tempore assumenda ratione ducimus repellendus, Molestias occaecati commodi quae perferendis, Molestias quasi repudiandae provident veritatis, Numquam, Perferendis qui quam at commodi perferendis accusantium hic, Quisquam molestiae, Repudiandae, Rerum mollitia modi similique nulla non velit, Sequi sequi ducimus, Totam quasi explicabo, Voluptatem
Eduardo Duarte;Adipisci atque laborum, Alias nostrum, Animi, Architecto vitae, Aspernatur placeat, Deleniti laborum, Doloremque iure quibusdam atque cumque voluptas, Dolorum, Et dolor, Harum inventore rem labore sunt, Illo at itaque quisquam quisquam quae, Ipsam, Nobis repellat corrupti consequatur laudantium, Non maiores dignissimos consectetur illum earum dicta, Nostrum suscipit debitis sint, Numquam temporibus eligendi facere ad expedita dignissimos voluptatibus, Officiis doloribus officia, Praesentium eius at vero, Quos delectus dolore sed unde nemo ipsam, Recusandae ipsum iusto, Reprehenderit possimus rem error, Sapiente, Sit iusto vitae corporis odit sint eligendi quidem, Unde unde voluptatibus
Elisa Lima;Asperiores, Corrupti repudiandae earum, Dignissimos quasi, Eaque ipsam tempora, Earum molestiae laboriosam explicabo nobis dolorem cumque, Esse, Illum, Incidunt, Ipsam maiores omnis dolorum accusantium, Itaque eius molestias, Iure, Magni numquam numquam perferendis nihil, Maiores blanditiis possimus optio, Necessitatibus, Occaecati cupiditate iure iusto, Placeat magni veritatis sunt officia labore, Quos rem architecto veniam vitae, Rem error quis sequi natus a saepe eos consectetur, Sed, Sequi expedita atque occaecati, Sit similique, Unde illo quae illum
Elisa Moreira;Adipisci cum, Alias dolorem quaerat dolorem quo, Amet, Amet inventore facere, Et voluptatibus ducimus dolorem voluptatibus laudantium delectus, Excepturi ipsum, Hic, Illum quas eius ut aspernatur quisquam labore, Libero cumque iste occaecati quo, Molestias commodi delectus esse, Nam provident sapiente assumenda nam et, Numquam, Odit, Placeat doloremque aspernatur culpa libero pariatur harum voluptatem, Ratione
Eloah Sales;Accusamus ipsam impedit voluptatibus, Ad, Amet sapiente, Assumenda, Assumenda amet, Consequatur harum aut ut quas, Dolorem iusto deleniti, Dolores, Expedita dolorum, Explicabo ea, Ipsa repudiandae magni neque ad facere, Labore temporibus voluptatem quae, Minus, Non maiores dignissimos consectetur illum earum dicta, Pariatur, Placeat tempora aut inventore, Porro, Reprehenderit hic at iusto debitis nostrum, Sequi molestias, Totam, Vero unde necessitatibus magni inventore, Voluptas voluptates quas rem itaque molestiae
Emanuel Carvalho;Ab magni itaque id necessitatibus corporis, Ad illo hic autem, Amet, Consequatur expedita repellendus sequi culpa cumque culpa, Cupiditate, Dolorum, Explicabo, Explicabo eaque molestiae eos ullam dolor quae, Hic magni exercitationem, Id debitis, Illum voluptate facere est inventore ut deserunt, Iusto id ipsam cum rem maxime iure minus, Maxime nobis deserunt voluptatem provident, Molestias ipsam eaque tempora placeat exercitationem, Mollitia modi, Nihil quo sit, Odit, Omnis, Perferendis, Perferendis nostrum natus laudantium cum, Perspiciatis assumenda, Praesentium, Quam perspiciatis accusamus unde magnam, Quasi, Quisquam tenetur quis similique iure, Quod error unde rerum doloremque distinctio accusantium
Emanuel da Cunha;Asperiores eos facilis, At, At blanditiis animi aut, Commodi repellat ipsa fugiat labore voluptatem ut aliquid, Cumque sapiente neque, Esse dolorem sequi, Eum corporis praesentium, Fuga voluptas illum quas, Officia quod, Optio quae qui porro similique assumenda, Quaerat corrupti ipsum quidem, Quia facilis nam laborum optio cum est, Quisquam fugiat, Ratione, Repellat excepturi cupiditate maxime repellendus voluptates hic, Sed, Similique amet fuga nesciunt labore fugiat nihil repudiandae, Temporibus temporibus, Ullam, Voluptate, Voluptate
Emanuella Aragão;Accusamus blanditiis fugiat laudantium, Atque nemo, Blanditiis id inventore molestiae, Doloremque excepturi, Doloribus, Dolorum aperiam suscipit necessitatibus id, Est deserunt voluptas quaerat vitae illum, Excepturi natus delectus a laborum, Facilis nulla quas consectetur optio qui, Hic illum dignissimos, Illo quas non sapiente facilis saepe, Illum incidunt assumenda, Laboriosam maxime consectetur accusantium ea nihil rerum praesentium rem, Natus, Occaecati fugiat laboriosam, Quidem consequuntur voluptate pariatur, Reiciendis, Soluta quod mollitia tempora, Ullam mollitia natus ullam quis repellendus, Voluptatum corrupti debitis necessitatibus libero vel libero
Emanuella Farias;Accusamus voluptatem consequuntur, Expedita nemo exercitationem totam magnam maxime, Facere, Inventore inventore minima voluptates, Labore, Laboriosam provident ad hic, Laboriosam rem quo nulla sunt perferendis, Laborum voluptas, Minus nesciunt dolores quaerat sint omnis, Molestiae repellat, Molestias placeat amet ad saepe adipisci est, Placeat tempora aut inventore, Quibusdam non, Quos delectus repellendus, Sint id voluptatibus molestiae sunt, Voluptate
Emanuella Novaes;Aliquid deleniti, Amet deserunt, Architecto, Cumque laboriosam odio, Impedit quia, In necessitatibus quibusdam quam ratione eaque, Inventore magni quidem, Nam similique praesentium debitis perferendis id, Natus saepe ea deserunt odit voluptate consequatur facilis, Nihil voluptas facilis facilis, Numquam quaerat, Officiis amet numquam distinctio, Placeat officiis libero harum sed, Praesentium suscipit impedit cumque, Quibusdam ratione quae inventore beatae quae consectetur, Reiciendis, Repellat, Sit eum, Velit commodi ducimus amet, Veniam cupiditate vel
Emanuelly Aragão;Autem, Commodi culpa veritatis, Consectetur laudantium architecto a possimus consequuntur veritatis, Cum quia quibusdam numquam alias, Dicta, Et explicabo, Eveniet tempora est voluptates, Excepturi repellendus omnis, Maxime quo, Nemo dignissimos laboriosam, Neque repellat voluptas non quis dicta rerum, Nisi perferendis accusantium est architecto possimus natus, Optio suscipit nulla, Quae, Quibusdam, Ratione esse vitae, Reprehenderit, Similique nemo vitae non qui, Sint qui soluta vel ad, Sit sit nostrum quae sint omnis minus in, Tenetur cumque, Ullam, Unde dolorem at consequatur nesciunt dolores sunt, Voluptatem deleniti voluptate eligendi impedit, Voluptates
Emanuelly Cavalcanti;Accusantium vitae nemo architecto laboriosam debitis, Ad ex autem aliquid iste quos, Alias reprehenderit mollitia neque, At, Debitis placeat possimus, Dolores doloremque eligendi libero adipisci dolorem magnam nesciunt quia, Eos expedita nesciunt deserunt, Et occaecati pariatur animi distinctio dicta sit, Excepturi modi, Illum occaecati, Iusto provident, Nobis rerum ab aut illo est excepturi dolore est, Nulla reiciendis nulla voluptatem blanditiis possimus aperiam ipsum, Numquam commodi porro ipsum, Quae, Quas delectus saepe nobis dolor, Voluptate delectus repudiandae
Emanuelly Jesus;Consequuntur, Dolorem facilis natus eos, Doloribus vel, Eaque voluptas fuga eius ratione, Eligendi at magni, Expedita deserunt voluptatum quam necessitatibus dolore, Ipsum, Iure, Laborum sapiente, Nobis, Repellat distinctio nemo tempora cum cum, Suscipit, Tempore ad illum, Unde omnis iure alias laboriosam earum, Veritatis, Vero ratione officiis numquam error, Vitae tempora architecto velit rerum, Voluptates minima
Emanuelly Nascimento;Aliquam cum nobis, Aspernatur quasi excepturi praesentium voluptates voluptas, Blanditiis totam necessitatibus, Consequatur debitis nam autem, Delectus repellat fugiat vitae, Dolores doloremque tempora explicabo sint iusto, Doloribus voluptatem sequi eveniet, Ea, Illum, Illum corrupti, Illum dignissimos qui, Modi velit eos, Numquam, Officia veritatis ipsam unde esse dolor itaque, Quae necessitatibus dolor maxime eum, Ratione architecto laudantium nisi quaerat animi sapiente, Recusandae, Reiciendis deserunt omnis non, Sunt error, Tempora ratione quis ut commodi, Vitae pariatur, Voluptas, Voluptates
Emilly Lopes;Ab est dignissimos accusamus occaecati, Accusantium alias beatae vel, Amet praesentium alias eius, Eaque ipsam tempora, Eaque qui tenetur aliquid delectus dignissimos consequuntur saepe, Enim id non eaque fugit quidem corrupti ab, Fuga porro eum facere iusto cum, Ipsum veritatis nostrum excepturi alias porro suscipit, Nostrum in id doloremque est voluptate sequi temporibus, Odio, Odit, Quidem corrupti quidem, Ratione et tenetur, Sapiente, Sit minima delectus porro, Unde quod ipsum aspernatur deserunt, Vel vel consectetur enim, Voluptas, Voluptatum exercitationem adipisci dolorem non possimus
Emilly Souza;Aspernatur facere autem ex, Atque vitae, Beatae velit quas officiis dolorum, Consectetur nam, Corrupti dolor expedita accusantium, Cupiditate soluta ullam sed voluptatibus vero, Dicta esse sunt aliquam, Dolore, Eligendi laudantium maiores veniam accusamus consectetur, Explicabo sunt occaecati aliquam incidunt, Illo quos vitae rerum, Laborum perspiciatis, Minima at voluptas vero, Minima molestias ea asperiores quae doloremque magnam, Odit id maiores sunt, Perspiciatis cumque, Quaerat architecto ab est itaque vitae assumenda sequi quas, Quibusdam sapiente tempora dolor eligendi error reprehenderit nostrum, Quos corporis molestiae inventore fuga maiores
Enrico Monteiro;Alias, Consequatur harum aut ut quas, Corrupti, Cum cupiditate aperiam cum velit perspiciatis, Dignissimos accusantium in blanditiis vitae deleniti repudiandae, Dolorem repudiandae repellat numquam, Dolores excepturi, Excepturi reprehenderit excepturi, Illo esse, In, Libero laborum explicabo quam placeat, Nihil ipsam nostrum minus commodi, Quisquam, Reiciendis officia maxime deserunt ipsam consequuntur laudantium, Sapiente officia consectetur, Sint incidunt atque, Soluta cum placeat earum minima, Voluptate eveniet veniam eos nemo nam
Enrico Moraes;Beatae dolores minima, Debitis, Et illum voluptates sequi maiores dicta commodi, Excepturi natus delectus a laborum, Libero cupiditate blanditiis facere fuga sit, Minima enim rerum architecto nemo amet fuga, Modi, Modi dolores eos quis, Omnis omnis quidem iure, Quos, Rerum adipisci amet alias dicta pariatur sunt, Sapiente ad autem, Temporibus veniam quis debitis, Voluptate eveniet veniam eos nemo nam, Voluptates
Enzo Carvalho;A dolores necessitatibus perferendis, Adipisci architecto, Animi doloribus illum quam, Earum incidunt nulla optio neque sit minima expedita, Earum sequi quisquam expedita doloremque, Eos, Eveniet quidem veritatis iure eos eum quod, Facilis expedita dolore tenetur, Illo recusandae nobis asperiores eos facere illo beatae possimus, Illum, Illum itaque totam explicabo, Iure quas soluta magnam maxime eius repudiandae, Iusto, Non est, Quaerat repellendus minima aperiam neque a exercitationem, Quasi corrupti odit, Quibusdam blanditiis quod dolorem itaque, Repellat vero magnam id unde, Sunt, Temporibus asperiores natus autem, Vel, Veritatis aliquam optio quod sapiente reiciendis, Veritatis est, Voluptates autem impedit reiciendis repellendus earum eligendi
