Joana Ramos;Aliquid laudantium cum doloribus blanditiis, Assumenda accusantium sed saepe saepe repellendus odit impedit, Debitis eveniet iure labore repellendus vitae, Dignissimos illum laboriosam dolore veniam laboriosam repellendus laudantium optio, Eos iure, Error, Excepturi, Harum blanditiis facilis iste sunt, Hic, Magni repellat ad aperiam nobis, Nemo, Numquam, Quos, Reprehenderit, Sed quaerat vitae, Suscipit ullam aut, Velit facilis
Joaquim Nascimento;Accusamus, Commodi nostrum cupiditate repellat quisquam provident, Cumque sequi, Deleniti porro quia quo, Est, Et qui debitis ipsam excepturi sit labore dolor et, Eveniet, Excepturi, Facilis, Itaque atque itaque hic perferendis, Molestias harum odit distinctio, Neque reprehenderit reiciendis exercitationem labore ducimus, Occaecati dolore ex voluptate, Omnis occaecati, Placeat, Quasi soluta consequatur error, Suscipit dolorum officiis dolorem, Temporibus tempore, Totam quibusdam accusamus quasi
Joaquim Souza;Aut totam et veniam assumenda numquam, Corporis totam reiciendis cupiditate expedita, Corrupti ex consequuntur, Ducimus, Eaque, Excepturi ex ut velit amet sed possimus, Inventore officiis sunt, Magni atque quae accusamus in beatae corporis facere, Maiores, Maiores veritatis quas nobis, Non illo similique, Nulla eos occaecati adipisci nemo odit, Officiis praesentium quibusdam facere veniam, Possimus hic adipisci natus, Quam quaerat dolor, Quis sit quibusdam quam quasi vitae quibusdam, Reiciendis omnis, Sit, Tempora, Tenetur saepe, Ut id, Veritatis optio voluptatum eaque ex commodi id occaecati
João Gabriel Farias;Ad, Animi, Architecto accusantium id facilis quos repudiandae, Asperiores distinctio itaque facere cupiditate, Aspernatur repudiandae nemo molestiae, Atque assumenda eum dolorem, Aut, Deleniti quod, Dolore repudiandae non, Explicabo sit eius voluptatibus autem, Harum mollitia minus tenetur odit mollitia consequatur nihil, Hic exercitationem modi nemo molestiae ratione saepe quam aliquam, Impedit et, Itaque, Libero illo iusto vel, Molestiae dolor laborum iste sequi distinctio impedit, Nihil, Omnis, Porro, Quibusdam maxime, Recusandae dolores laudantium, Tempora, Ullam, Vel natus eligendi eveniet ducimus nam veritatis, Voluptatem
João Miguel Cardoso;Ad qui doloribus, Architecto, Commodi vitae eius perferendis cum ex nemo doloremque, Consectetur quo qui ullam odit deserunt, Dolor accusamus, Dolorem reiciendis, Ea ab ad, Ea laudantium impedit, Eligendi distinctio fugiat repellendus quibusdam, Excepturi excepturi, Excepturi reprehenderit excepturi, Expedita occaecati, Facilis inventore, Fugit rerum eum dolores, Ipsa voluptate omnis mollitia, Minus nesciunt dolores quaerat sint omnis, Necessitatibus, Quasi libero harum dolores, Sint, Totam commodi labore alias aliquam esse, Vel, Vero odit quo
João Pedro Lima;Accusantium, Accusantium placeat commodi, Blanditiis eum quod, Eaque, Eius delectus mollitia iure, Eligendi, Eos sit, Excepturi nostrum reiciendis quas minima, Facilis culpa maxime, Hic deserunt, Inventore officiis sunt, Maxime facere, Minima velit, Natus impedit, Necessitatibus fuga sunt cum, Nemo aperiam corporis reprehenderit, Odio, Perspiciatis, Similique possimus nulla
João Pedro Peixoto;Accusamus, Alias at corporis odit id cumque possimus, At nam earum voluptatum, Beatae omnis, Consequuntur, Corporis explicabo quasi laudantium, Dolores tempora, Eos, Hic fugit quisquam officia aperiam eos, Ipsa repudiandae magni neque ad facere, Iste ratione voluptates esse non deleniti, Laborum vero, Modi doloremque placeat, Odio, Odio, Officiis pariatur in, Tempore, Tempore eligendi temporibus cum, Unde
João Pedro Ribeiro;Ad fugiat rem, Aperiam laboriosam nam suscipit fugiat adipisci adipisci perspiciatis, Asperiores atque cumque, Atque quod aperiam iure magnam porro, Blanditiis unde cum laboriosam, Commodi hic sed excepturi, Consequuntur, Excepturi blanditiis rem, Excepturi deserunt in non fuga molestias eius blanditiis, Illum beatae mollitia, Magni atque, Similique illo, Sit voluptatum deserunt incidunt exercitationem blanditiis dolores, Sunt amet porro dignissimos exercitationem, Voluptate delectus repudiandae
João Vitor Vieira;Alias aliquam mollitia necessitatibus, Dolorem rem laborum itaque quos similique nostrum, Eaque minus odio, Explicabo ipsa tenetur cum, Iste, Iusto ipsam quos, Maxime quam culpa nobis ratione architecto quia rem, Neque maxime, Odit magni corrupti officia, Omnis non, Perspiciatis assumenda, Porro soluta natus quibusdam debitis, Quasi expedita aut, Quos architecto optio, Reiciendis, Rem facere sunt, Saepe, Voluptatem accusantium animi natus veritatis, Voluptatibus fugiat voluptatum omnis quas iusto
Julia Rodrigues;Animi at, Architecto asperiores, Asperiores, Asperiores, Beatae ab id in, Dolorum, Eaque placeat quidem possimus, Eos distinctio exercitationem necessitatibus expedita numquam perspiciatis, Eos earum, Et temporibus, Eum, Illo omnis, Illo possimus quod, Iste consequatur provident a voluptatibus, Neque consequatur fugiat, Nostrum laboriosam, Numquam, Occaecati, Quia cupiditate quae soluta recusandae eos, Quo atque voluptatem officiis eaque aut quidem accusamus, Recusandae beatae pariatur recusandae cumque maxime, Saepe tempore animi quod asperiores modi provident minus, Similique minima porro eligendi itaque
Kaique Pinto;Accusantium placeat commodi, Architecto doloribus asperiores quibusdam, Autem ad delectus, Corrupti ex consequuntur, Ex, Explicabo quis odit a officiis, Fugit, Harum at, Illum, Impedit ducimus doloremque labore occaecati, Impedit et, Mollitia, Nemo consectetur, Nihil iure architecto, Nisi exercitationem, Nisi quibusdam, Occaecati, Porro quaerat, Quae iusto nulla totam iure sit, Quasi dicta recusandae ipsam temporibus occaecati, Soluta sapiente fuga quis dolores eveniet, Vel, Vel maxime repellendus, Voluptatibus eius molestiae iure exercitationem voluptatem voluptatum quos
Kaique Sales;Aliquid commodi amet officiis blanditiis, Animi et accusantium, Autem natus perspiciatis delectus ad ipsam, Beatae velit quas officiis dolorum, Commodi ipsa, Cumque porro, Deserunt architecto illum facere blanditiis tempore neque rem suscipit, Eligendi, Eos voluptatum natus ipsam, Facilis aliquid fugit a eaque, Ipsum voluptates doloremque cumque, Iure tenetur harum repudiandae quisquam officia fugit, Laboriosam, Neque, Tempore maiores sint perspiciatis recusandae quidem autem, Veritatis voluptas rerum hic numquam, Vitae
Kamilly Viana;Accusamus, Ad sint reprehenderit explicabo dolor, Aspernatur alias quae, At sapiente sed explicabo corporis tenetur, Beatae eaque id ipsa quibusdam optio, Dolor delectus mollitia doloribus consequatur quis, Earum consequatur ab distinctio quas expedita aut, Et, Et dolorem rem, Eum, Eveniet, Eveniet quas deleniti assumenda neque sint, Fugiat voluptatum aut alias vitae minima culpa, Illum dignissimos qui, Molestiae in, Nulla necessitatibus, Odit quaerat eum corporis magnam suscipit dicta, Odit suscipit tenetur possimus qui dolorum culpa, Porro autem sint earum temporibus omnis, Porro natus temporibus vitae deleniti, Porro repellendus dolorum, Quas quos ullam, Quia cupiditate quae soluta recusandae eos, Reiciendis nam ex itaque magnam et, Voluptate porro corporis id quibusdam
Kevin Moura;A tempora corrupti nihil iste facilis, Consectetur aliquam, Culpa, Ea, Eligendi, Ex, Ipsa, Labore temporibus voluptatem quae, Laboriosam, Perferendis adipisci veritatis voluptatibus quos, Porro iusto dignissimos ex ullam recusandae quia alias expedita, Quae laboriosam inventore, Quibusdam deserunt repellendus, Sed, Temporibus temporibus, Tenetur dolore alias quia consequatur et, Velit at ut aspernatur, Veritatis aut ab ab voluptatum
Larissa Azevedo;Accusantium sapiente eius, Ad blanditiis, Aliquam illo dolore quia, Aperiam asperiores aperiam, Autem voluptatum facilis accusantium, Corrupti molestias cupiditate, Ducimus quisquam fugiat esse, Eos porro reprehenderit perspiciatis eligendi deleniti, Est corporis autem nesciunt, Expedita qui ab, Explicabo, Hic nobis quo exercitationem recusandae, Illo, Iure ipsam quibusdam, Libero nobis laborum doloremque, Magni, Nesciunt, Nesciunt, Nisi neque, Nulla temporibus, Possimus delectus dignissimos laboriosam magnam asperiores nisi corrupti odio, Reiciendis ratione aliquam, Tempora, Temporibus vel omnis minima, Voluptate quas
Laura Alves;Ad qui asperiores nostrum perferendis, Aliquid dicta maiores, Aliquid rerum non voluptatum vero, Commodi expedita illum neque quam facilis quibusdam, Consequuntur animi, Corrupti libero tempora, Cumque dicta dignissimos, Cupiditate rem non dicta ipsam nam, Dignissimos maiores maiores, Distinctio sunt, Dolorem repellat ad, Doloremque rem explicabo modi fuga iusto quae, Eaque commodi et, Earum eveniet facere incidunt quasi, Eveniet magni aliquid labore placeat delectus cumque amet corporis, Ex atque praesentium voluptatem minus, Fugit animi adipisci quam quod excepturi minima, Incidunt eaque veniam, Omnis sunt incidunt voluptas, Quaerat vitae fugiat fuga amet, Ratione debitis aliquid odio, Repellendus officiis non, Rerum deleniti, Sapiente quibusdam quos
Laura das Neves;Consectetur natus ipsa, Dolore veniam recusandae suscipit, Eligendi, Eos modi, Explicabo ea, Facilis iure corporis distinctio illum suscipit ducimus, Iste necessitatibus accusantium modi ut, Laboriosam nam suscipit perspiciatis quis, Nisi laborum, Quas ut officia nihil nulla numquam occaecati pariatur pariatur, Quo in tempora repellat, Sapiente ad voluptates dolor accusantium veritatis, Veritatis vel, Voluptatem nihil error, Voluptatem temporibus pariatur
Laura Farias;Asperiores alias modi beatae recusandae aspernatur, Assumenda officiis dolore assumenda provident animi, Corporis ab nam, Cumque quas necessitatibus incidunt, Debitis voluptates quam deserunt ex pariatur odit illum, Ducimus, Eaque, Eaque ab consequatur, Eius quis distinctio a incidunt modi minus dolorem, Facere quis ipsum in, Minima, Officia harum, Omnis sunt incidunt voluptas, Quae necessitatibus dolor maxime eum, Quibusdam laudantium ipsa voluptate impedit, Quos natus, Repellendus voluptate voluptas dolores fugiat corrupti, Sunt iste sit ad recusandae magni, Unde blanditiis unde doloribus necessitatibus laudantium, Velit repellendus expedita, Voluptatibus fugiat voluptatum omnis quas iusto
Laura Freitas;Amet eveniet reprehenderit soluta tenetur, Commodi eligendi, Enim sit iure, Facere sapiente odio eligendi est ab ea, Illo, Ipsam hic rerum dolore repellendus molestias, Iusto hic, Laudantium, Magni odio sint, Molestiae laboriosam enim id veritatis culpa, Natus saepe, Necessitatibus perferendis nobis vitae, Nemo laudantium sequi animi iste, Odio quaerat aliquam quidem vero, Odit molestias doloremque beatae ea qui vitae, Quibusdam modi molestias sunt sed voluptates rerum, Quisquam, Quisquam cupiditate ea, Quos, Quos ut dolorum inventore, Reprehenderit unde ducimus, Similique esse laboriosam ad eligendi, Ullam nobis provident repellendus qui quos dolorem natus
Laura Martins;A reprehenderit est magni, At, Eaque, Est, Laboriosam dolore explicabo minus laboriosam, Nisi, Nisi, Nisi molestias, Nobis labore minima autem eum dolorum, Omnis fugiat expedita exercitationem debitis, Quaerat hic ipsa mollitia molestiae voluptas, Quas facere, Quis, Quos maxime, Quos nam asperiores fugiat, Ratione laudantium, Ratione quisquam temporibus enim quae, Repudiandae, Totam aperiam cum veritatis culpa maxime, Voluptas, Voluptatum exercitationem saepe earum qui ex
Lavínia Pires;Accusamus provident impedit, At deserunt saepe, Beatae, Dignissimos velit reprehenderit necessitatibus laudantium a et, Distinctio cumque quibusdam consequuntur quod sit voluptate, Ducimus, Ducimus ipsa, Eligendi tempora officia nam esse praesentium, Eveniet ab amet magni sit, Excepturi optio sed vitae, Illum nam rem at, Magni reiciendis eveniet, Odio sapiente facilis a qui aliquam eligendi, Quidem exercitationem ipsam ab, Rem vel ducimus corporis ex nesciunt expedita, Voluptatibus dolorem similique libero
Laís da Paz;Ad alias quam, Aliquam nesciunt, Autem voluptas fuga, Corrupti, Cum minus officia consectetur corrupti neque, Deserunt, Ex at sit, Fugit in fugiat aliquam quidem, Incidunt voluptates incidunt voluptatem, Neque at dolores quidem, Nesciunt, Odio aperiam occaecati ullam beatae, Officia aliquam eaque corporis dolore mollitia cupiditate est, Perspiciatis, Quam dolore quos, Quas sapiente itaque veniam, Quia error magnam, Quod magnam quaerat tenetur
Laís Novaes;Aliquam consequuntur similique hic libero, Aliquam distinctio soluta veniam perspiciatis, Beatae recusandae voluptate voluptate, Dolorem, Error ipsam suscipit ad officiis quae aperiam tenetur, Esse, Impedit eos, In non id labore quae rem necessitatibus, Ipsa tempora modi porro ut illo, Ipsam vero consequatur, Itaque eaque pariatur voluptatibus, Mollitia consequuntur consectetur mollitia autem accusamus libero, Nam aliquam repellendus in dolores recusandae nulla repellendus, Nemo iusto qui cumque, Odit eligendi, Quae doloribus impedit sapiente, Quaerat cumque tempora fuga eos rerum officiis, Quasi pariatur soluta, Quibusdam deserunt repellendus, Quidem ipsum enim similique id, Reiciendis quam fugiat aut nobis, Rem corporis, Repudiandae modi ab, Velit soluta, Veritatis sunt magni
Laís Teixeira;Aperiam asperiores aperiam, Architecto praesentium molestiae aliquam architecto illo quas quasi, Architecto voluptatem adipisci, At sapiente sed explicabo corporis tenetur, Beatae rerum occaecati minus iure tempore, Blanditiis, Dolorem, Eligendi laudantium maiores veniam accusamus consectetur, Ex aut expedita enim libero, Fugiat, Hic ex architecto ex, Laboriosam, Laborum nihil sapiente, Maxime corrupti unde commodi, Modi, Molestias iure, Optio, Perferendis quia est, Quis ipsa ullam doloribus perferendis, Quod laudantium aut, Repudiandae, Sit sit nostrum quae sint omnis minus in, Tenetur, Totam nulla dignissimos voluptatibus atque inventore, Ut placeat, Velit, Vitae, Voluptatum
Leonardo Costa;Ab delectus facere molestiae dolores suscipit dicta, At dignissimos sequi ea, Delectus reiciendis voluptatibus necessitatibus deleniti reiciendis veniam laboriosam, Distinctio veritatis error amet cupiditate asperiores tempora, Doloremque, Ducimus quisquam fugiat esse, Eius quisquam sunt dignissimos maiores quia, Expedita est natus ab veniam officiis, Fuga omnis qui totam veritatis, Id, Itaque, Laborum voluptas debitis corporis quos, Maxime ipsa accusamus eveniet, Minima nisi, Mollitia, Natus magnam, Nisi, Odio quaerat voluptatem aspernatur, Omnis sunt impedit nobis incidunt necessitatibus provident, Quaerat dolor impedit, Quas quis libero numquam laborum ullam ipsum neque nostrum, Quis voluptatibus, Quod error unde rerum doloremque distinctio accusantium, Rem iure ut commodi magni laboriosam, Repellat, Sapiente velit, Sed deleniti nam, Tempora veritatis, Velit, Veritatis possimus sit velit delectus odio, Vitae magnam eaque sunt mollitia, Voluptatem accusantium animi natus veritatis, Voluptatibus aliquam voluptates beatae, Voluptatum enim explicabo
Leonardo Lima;Commodi expedita illum neque quam facilis quibusdam, Culpa libero quaerat voluptate libero error dolorem, Deleniti totam aspernatur totam temporibus, Distinctio deleniti fugiat nihil nesciunt, Distinctio voluptatum fuga, Error fugit accusamus consectetur quod, Eum, Ex aut expedita enim libero, Excepturi architecto ab maxime sit illo, Fuga explicabo veritatis, Magni nulla facere quam laborum blanditiis, Modi nisi, Mollitia delectus adipisci ratione, Nisi expedita, Nobis voluptates, Nulla alias fugiat sit dolorem aspernatur, Provident, Provident, Quidem quasi accusantium, Quos adipisci ducimus, Sit, Sit ducimus vitae ullam sequi quae voluptatem facilis, Soluta praesentium dolorem qui dolorum veniam labore, Velit deserunt dolorem perspiciatis unde aut, Veniam at voluptates debitis tempore possimus odit doloremque
Letícia Almeida;Accusamus fugit earum adipisci earum dolorem explicabo recusandae, Aliquam sit nisi rerum, At eligendi, At temporibus eaque error, Debitis unde quo nostrum quae, Dignissimos voluptas, Ducimus, Earum labore placeat ea deleniti, Ex, Id autem, Illum est, Itaque dolores excepturi id, Laudantium provident nemo necessitatibus doloremque, Libero error facere nemo nisi praesentium, Modi quos, Molestias laudantium, Nam nisi, Nemo sed magni possimus dicta sit, Nemo unde ea quo ducimus, Nisi reiciendis dolores eveniet, Non odit sint pariatur sit magni ad amet saepe, Optio, Praesentium omnis nulla quam rerum beatae facere cumque, Quaerat vitae fugiat fuga amet, Sed delectus doloremque molestias, Tenetur temporibus voluptate, Veritatis fugit voluptatum praesentium sed laboriosam
Letícia Cardoso;A, Accusantium laudantium sequi maiores sit possimus dolorem, Ad dicta, Alias fuga asperiores, Assumenda repellendus, Commodi deserunt quidem neque minus, Deleniti officia quae, Dolor nesciunt voluptate aperiam ut, Dolorem, Doloribus ut deserunt impedit, Eaque deserunt, Esse molestiae dolore, Excepturi sapiente nihil dolores dicta, Fugiat debitis repellat architecto, Incidunt, Iste laborum vel cum esse nulla suscipit ad, Necessitatibus veritatis error qui, Nemo reiciendis autem ullam reiciendis culpa, Neque nesciunt dolores nulla eaque, Nobis provident sed, Possimus nisi, Quae ducimus enim dignissimos itaque quae, Quas, Quisquam hic deserunt illo laudantium tempora, Reiciendis quod, Rem eligendi laborum, Sapiente suscipit, Sed quia earum quam laudantium ea illo, Veniam quibusdam
Letícia Freitas;Aliquid occaecati, Animi, Aperiam error officia distinctio, Asperiores sapiente eos et corrupti, Dignissimos id, Dolores est debitis nihil, Fuga recusandae inventore, Hic, Hic libero quasi error facilis harum numquam, Illo sunt nostrum molestias perferendis earum, Impedit illo assumenda nam eius ipsam, Impedit in molestiae nobis, Maiores, Nobis, Numquam eveniet perferendis, Officia velit, Perspiciatis exercitationem tempore quod voluptas aut, Rem vel ducimus corporis ex nesciunt expedita, Repudiandae dolore optio aspernatur eligendi, Sequi, Similique facere accusamus pariatur
Letícia Moreira;Blanditiis eligendi, Cupiditate, Eaque ducimus quam perspiciatis nesciunt, Expedita ipsam unde dicta, Facere, Illo quasi, Impedit, Incidunt culpa animi voluptatem aliquam esse magni autem sapiente, Inventore, Iusto nostrum eum eos quidem, Labore rem illo aspernatur, Laboriosam dolorum sint ut impedit, Mollitia, Optio, Pariatur delectus dolore, Provident dolore deleniti, Quam ex ipsam, Rem corporis, Repellendus, Ut aperiam adipisci, Veritatis perferendis rerum quis, Veritatis repellat tempore
Levi Cardoso;Accusamus odit ipsa impedit quia, Adipisci suscipit eaque rerum, Alias vitae, Aspernatur nesciunt possimus quaerat iste ratione, Autem, Dolore repellat veritatis, Dolorem, Ea nobis, Et, Ex, Facere, Illo tempora maiores nemo, Minus omnis non eaque quo voluptas laboriosam, Modi ullam alias quod laudantium voluptas nisi non quia, Molestias iusto rem, Nesciunt distinctio earum iste, Nesciunt occaecati, Praesentium, Quasi maiores rerum, Quasi veritatis dolore, Temporibus, Voluptas quibusdam nesciunt, Voluptate dolor
Levi das Neves;Accusantium officia, Commodi a nam, Deleniti sequi excepturi est, Error perspiciatis porro molestiae alias eos sapiente sit, Excepturi quidem sequi totam tenetur iure dolorum dolorum fugit, Fuga soluta, In nulla odio, Ipsa, Iusto ea tenetur laudantium veniam ipsam voluptate, Libero quo quod blanditiis, Magni cupiditate labore nam, Maxime esse nobis consequuntur, Pariatur quasi officia, Perferendis nostrum natus laudantium cum, Porro, Quae ab nemo, Quibusdam dolorem repudiandae quod, Tenetur
Lorena Costa;A, A tenetur, Consequuntur qui laudantium, Cupiditate ipsum rerum molestiae vitae, Delectus dolor saepe, Expedita natus ipsa iusto doloribus, Fugit dolorum nisi officia quaerat consequuntur voluptatum temporibus, Incidunt minima, Laboriosam rem quam animi occaecati cumque sequi vel, Magni corrupti quos porro enim asperiores, Nihil, Nisi, Officiis cum eum, Omnis, Possimus beatae praesentium nihil error suscipit, Qui, Quisquam, Sequi, Sit corporis ipsa deleniti, Veniam at voluptates debitis tempore possimus odit doloremque, Voluptate
Lorena da Rocha;Assumenda, Commodi quidem sequi ipsum at, Consequuntur quasi praesentium, Dolorem iusto ipsa expedita aliquam non, Dolorum nostrum, Ea, Ea eum quo tempore explicabo aperiam hic, Facilis incidunt praesentium nisi incidunt, Maiores repudiandae, Molestiae laboriosam quos eum in vel nemo, Molestias nulla, Perferendis, Porro natus temporibus vitae deleniti, Quaerat consequuntur veritatis, Quibusdam sunt eum, Reiciendis sit quidem minima, Repellat reprehenderit et dignissimos placeat labore rem at, Reprehenderit iste facilis, Reprehenderit reprehenderit, Repudiandae est molestiae, Sit libero velit beatae, Tempore enim commodi, Tenetur, Veniam maiores porro consectetur corrupti accusamus nostrum enim
Luana da Luz;Adipisci aspernatur sint est, Alias dolorem quaerat dolorem quo, Aliquam illo dolorum accusamus voluptas, Assumenda illum, Cum aliquam rem maiores, Enim iste quam, Labore, Nesciunt iste sequi praesentium explicabo optio iure, Non rerum aspernatur adipisci commodi, Placeat qui alias culpa aspernatur, Praesentium quibusdam rerum tempore, Quae, Quae architecto iure unde, Ratione iure aut, Saepe expedita aspernatur, Sit consequatur similique dolor expedita ipsum
Luana Silveira;Cupiditate laudantium quas, Deleniti officiis repudiandae repudiandae, Dolore corrupti necessitatibus officiis accusantium error animi, Eaque quaerat, Eveniet, Eveniet aut saepe recusandae vitae velit recusandae quis, Incidunt, Ipsum deleniti expedita esse, Laudantium consequatur quae tempora labore mollitia voluptatibus, Magni consequatur temporibus, Molestiae nesciunt possimus temporibus reprehenderit vitae nihil magnam cupiditate, Molestias repudiandae, Nam nisi, Quidem aliquid nisi, Reiciendis assumenda magni natus, Reprehenderit dolore sint minus officiis labore temporibus accusamus, Vel, Voluptate blanditiis repudiandae iste, Voluptatibus tenetur eveniet reiciendis illum
Lucas Moraes;Ab, Aspernatur hic enim, At rerum odit exercitationem, Aut laboriosam maiores odit, Commodi a, Consequatur, Dolores molestiae, Dolorum praesentium vero, Eligendi tempora mollitia fugiat quas, Esse nesciunt repellendus, Exercitationem, Facilis aspernatur sit praesentium autem laborum praesentium, Fuga, In eveniet quae provident, In necessitatibus quibusdam quam ratione eaque, Laboriosam rem quam animi occaecati cumque sequi vel, Quaerat odio, Quas iste modi, Quasi quaerat, Quidem totam magnam praesentium ex, Quis, Quod laborum aperiam odio laudantium, Recusandae incidunt similique ut illo, Reiciendis earum architecto fugiat cumque, Similique eligendi harum repellendus quas cupiditate blanditiis quos dolorem, Sit quis nostrum, Veniam magnam vel molestias saepe
Lucca Castro;Dicta laboriosam veniam nobis, Dolores saepe corrupti recusandae mollitia officia placeat, Esse, Eveniet perspiciatis dolorum, Exercitationem, Iste, Libero nisi praesentium, Magnam consequuntur inventore modi cupiditate repellendus, Nisi autem vel quisquam libero quas odio qui fugiat, Nisi quasi, Nisi sunt impedit repudiandae, Nostrum qui, Odio, Omnis sunt nesciunt aliquid soluta mollitia, Possimus veritatis corrupti, Praesentium provident, Qui, Quisquam iusto culpa nihil, Quisquam quasi vero rem, Sit, Sit sit nostrum quae sint omnis minus in, Unde esse dolores natus commodi assumenda, Vel error laudantium
Lucca Ribeiro;Accusamus, Aperiam fugit quis et adipisci nulla ut, Consectetur animi cumque dolorem corrupti quia placeat necessitatibus beatae, Delectus voluptatum cum quam possimus est quasi harum dolores, Et occaecati pariatur animi distinctio dicta sit, Explicabo dolores consequuntur nisi dolore, Illo sunt nostrum molestias perferendis earum, Ipsum veritatis aspernatur ipsum provident fuga iusto, Magnam at libero reiciendis, Minima, Nam, Nam odio, Optio eligendi illo, Quam ex ipsam, Quasi, Similique nisi corporis magnam, Vitae facere praesentium
Luigi Novaes;Aliquam accusantium dicta id, Aperiam, Deserunt, Dicta libero esse at, Dolores eligendi, Ea laudantium impedit, Error provident labore, Eveniet earum earum molestiae, Fuga ex repudiandae omnis possimus placeat a modi, Id, Iste possimus sed, Iusto corporis, Iusto debitis eos, Laboriosam maxime consectetur accusantium ea nihil rerum praesentium rem, Libero nam laudantium necessitatibus, Neque nesciunt dolores nulla eaque, Nostrum officiis voluptatibus fugiat magnam, Odit, Praesentium libero, Quia, Quos vitae optio, Reiciendis numquam, Rem ex labore debitis, Repellat temporibus error, Repellendus recusandae corrupti unde nisi, Reprehenderit consequuntur, Similique corrupti cupiditate, Soluta, Voluptatum quaerat iste sapiente laboriosam
Luiz Fernando da Cruz;Accusantium, Assumenda repellendus, Ea, Earum, Illo quasi, Libero ex itaque sunt dolorum, Minus excepturi, Modi, Nobis, Nulla at similique, Numquam earum ut aliquid a aliquid, Porro enim a praesentium ab placeat alias quasi sit, Quia, Quia facere corporis ipsum laborum nesciunt, Quis numquam quas ducimus, Quos aut, Repellendus, Repellendus adipisci voluptates inventore, Repudiandae ipsam repellat vitae voluptas enim corrupti, Similique amet fuga nesciunt labore fugiat nihil repudiandae, Sint ut quaerat consectetur quas maxime, Sit, Sunt dolore mollitia sint blanditiis ipsam perferendis voluptatem, Unde, Ut ipsam quae exercitationem vel quidem nesciunt eum blanditiis
Luiz Gustavo Mendes;Deserunt dolorem magnam eligendi aliquid est nam, Dolor, Dolorum possimus ipsa, Ducimus ipsa, Exercitationem dicta ullam ab, Fugit asperiores, Illum, Iste fugit, Laborum architecto consectetur ipsum, Maiores provident tempore veritatis, Reprehenderit repudiandae reprehenderit, Similique, Unde laudantium, Voluptate, Voluptates vero
