Luiz Henrique Correia;Asperiores impedit officiis non saepe iste sunt necessitatibus, Assumenda illum, Assumenda iure corrupti tempora, At corporis aliquid accusantium nisi in, Blanditiis placeat voluptas inventore illo distinctio, Corrupti corporis molestiae architecto eligendi iste et, Cum earum modi provident, Cum exercitationem consectetur voluptates repellendus dignissimos, Eaque commodi veritatis reprehenderit nemo tempore, Inventore veniam tempora id aliquid saepe minima, Iste dicta officiis minus, Itaque, Libero laborum explicabo quam placeat, Natus ducimus fugit, Nulla nesciunt aperiam, Odio odit quis cupiditate, Perferendis, Quo debitis ipsa delectus, Quo inventore fugiat delectus quo, Tenetur repellat provident tempore, Veritatis aut culpa, Voluptates iusto eligendi ea ipsum maxime beatae soluta
Luiz Miguel das Neves;Ab, Animi eius quo, Aperiam magni odit quibusdam reprehenderit corrupti reprehenderit at, Aspernatur quo quos quae deleniti expedita, Consequatur deserunt sint, Dolorem, Doloremque ullam quae earum, Ducimus sunt earum esse, Eius, Enim harum ab, Et, Expedita dignissimos nemo numquam, Magni maxime aliquam, Nesciunt molestiae natus, Numquam commodi porro ipsum, Quibusdam magnam, Repellat nostrum occaecati unde velit, Sequi maxime, Sit voluptatem quae voluptas perferendis, Totam autem perferendis
Luiz Miguel Novaes;Aliquid, Aspernatur odio at exercitationem nisi, Autem quisquam, Beatae rem nesciunt est placeat iusto, Corporis eius commodi unde autem fuga tempora est, Corporis tenetur aut repellendus, Dolore, Dolorem amet dolor distinctio placeat excepturi veniam, Et delectus odit, Fuga quisquam, Magni, Magni nulla nesciunt, Minima aut praesentium molestias delectus, Neque, Nobis, Odio cumque aut hic iste, Optio quod neque illo vero maxime commodi, Placeat, Possimus possimus accusamus doloremque ea, Quidem enim ab, Quos officia praesentium odit animi perferendis, Rem facere sunt, Saepe, Vel error odio voluptatem non, Vitae sequi cum assumenda magnam debitis
Luiz Miguel Peixoto;Delectus dolore ex aliquam, Dolores vitae aspernatur totam, Earum aliquid porro blanditiis doloremque, Enim dolore, Enim iusto quisquam, Esse eum illo ut molestias ex, Fugiat, Incidunt, Inventore fugit sint eaque voluptates voluptate tenetur, Optio quae qui porro similique assumenda, Quas animi porro, Quasi, Saepe repudiandae vero ipsa, Sapiente officiis corrupti expedita dolorem, Sint fugit necessitatibus a maiores laborum perferendis cumque possimus, Sint nesciunt cum exercitationem nulla ad, Sunt laborum, Tempore a iusto veniam fugit odio veritatis, Velit deleniti et fuga temporibus deserunt, Vero architecto corrupti, Vitae error dicta, Voluptatibus cupiditate illum cum id rem
Luiz Otávio Barros;Alias repellat odio, Architecto aperiam, Debitis, Dignissimos quas voluptatum at, Dolores eligendi, Ea, Ea architecto alias eaque, Eligendi aliquid quos qui tempora vel, Eos, Eos reprehenderit pariatur, Fugit nihil, Inventore exercitationem, Iste exercitationem explicabo aut minus, Libero cumque iste occaecati quo, Minus excepturi, Nemo ipsum quia doloremque molestiae perspiciatis consequuntur, Nesciunt molestiae natus, Nulla, Optio, Porro at quae id sequi eaque, Quam, Quia officiis ut quasi ea qui accusantium quos nobis, Quia veniam, Quibusdam non, Rem, Sint, Tempora dolorum accusantium provident quae velit repellat, Voluptas rem non assumenda odio eaque
Luiz Otávio Porto;Accusamus tempora quae officiis necessitatibus perspiciatis quod, Accusantium, Consequatur quia, Consequuntur odit vero possimus blanditiis incidunt, Corrupti distinctio, Deleniti mollitia dignissimos voluptatem nihil ratione, Dolore ea minus cupiditate nemo voluptates, Ea, Ea neque fugiat, Eligendi praesentium, Fugit asperiores, Iure quam, Laboriosam voluptatem asperiores, Maiores ullam nisi, Necessitatibus velit, Occaecati voluptates, Odit recusandae vitae tempora aut facilis repellat, Quas repudiandae, Suscipit fuga sapiente velit
Manuela Fernandes;A vel temporibus sunt, Alias architecto, Aperiam, Assumenda, Delectus, Deleniti placeat, Ea, Enim, Eveniet aut saepe recusandae vitae velit recusandae quis, Facilis fugiat, Fuga, Illo, Illo dolor mollitia dolorum hic dignissimos, Magni, Magni odio sint, Non voluptates architecto, Numquam laudantium, Numquam reprehenderit maiores voluptatum, Occaecati, Odit molestias doloremque beatae ea qui vitae, Odit quasi nisi neque soluta, Possimus sint perferendis, Provident aliquam ad possimus vel ratione, Quisquam iusto culpa nihil, Recusandae error esse similique perferendis dolores maxime numquam, Repellat aspernatur rem quidem perspiciatis excepturi, Rerum nulla dicta perspiciatis exercitationem, Sapiente hic ea, Similique impedit necessitatibus, Veniam fugiat veniam velit hic, Voluptatum eaque quas quam odio iure
Marcela da Mota;Adipisci, Architecto sequi tempore, Atque officiis laboriosam, Debitis earum quo veritatis, Delectus aspernatur nam labore vel accusamus, Deleniti occaecati natus doloribus facere adipisci dolores quasi culpa, Deleniti quidem consectetur similique ea id vero, Dicta accusamus modi quam nesciunt, Dignissimos eaque enim porro quisquam molestiae similique alias odit, Distinctio at ipsa laudantium doloremque distinctio, Ducimus, Facere ipsam atque nam velit soluta, Facilis temporibus possimus at voluptatum, Fugiat in, Ipsum corrupti, Libero maiores sit iure, Magnam assumenda quis ipsam facilis unde nostrum, Nam, Nihil sint amet amet id omnis repellendus, Non eum incidunt, Pariatur tempore excepturi distinctio veritatis tenetur quod, Quasi illum unde, Quo excepturi fugiat vel provident et, Quod distinctio recusandae excepturi, Ratione, Sint accusantium, Voluptas esse, Voluptates, Voluptates aperiam
Marcela Santos;A voluptates blanditiis, Beatae, Blanditiis odit totam ipsam doloremque quos sed, Culpa enim, Deleniti, Dolores odit error, Doloribus aliquam commodi quaerat, Error provident eum, Hic assumenda ratione dolore, Incidunt aliquam, Labore, Molestiae amet nostrum unde, Mollitia aspernatur ducimus nobis, Numquam temporibus molestiae accusantium, Quaerat modi fugiat, Quas rem similique facere iste quam excepturi, Quasi consequuntur nostrum cum, Quibusdam consequatur quae aut, Quos neque voluptatibus neque, Tempore et repudiandae quisquam, Vero, Voluptatibus illo nostrum, Voluptatum exercitationem saepe earum qui ex
Marcela Silva;Consequatur, Deleniti amet iste, Deleniti occaecati natus doloribus facere adipisci dolores quasi culpa, Dolor, Eaque est veritatis, Ex, Excepturi quo ad nihil perferendis vel voluptatibus, Exercitationem a maiores velit ad, Expedita perferendis tenetur libero, Fugit rerum eum dolores, Impedit, Inventore temporibus necessitatibus deserunt vero deserunt reprehenderit, Labore magnam dolorum eveniet alias, Laborum, Laudantium culpa sint, Maiores veniam quos, Molestiae, Nisi aut, Optio aliquid rem eum, Provident cupiditate accusantium rem, Quaerat expedita libero, Reprehenderit libero dolores officia quia, Rerum maxime illum quibusdam dignissimos, Suscipit ea quasi, Veritatis occaecati vitae
Marcelo Lopes;Animi, Beatae alias ratione veniam esse, Beatae omnis, Consectetur, Culpa, Cum magni explicabo rem praesentium accusantium animi, Earum, Error, Et, Eum distinctio enim pariatur incidunt, Eveniet necessitatibus optio corrupti, Inventore, Ipsam sit harum soluta saepe nihil voluptas veritatis quo, Iste aliquid dolore laboriosam, Officia velit, Tempora nam labore deserunt veritatis modi repudiandae, Veniam molestias, Vero possimus, Voluptatibus alias porro
Maria Alice da Rosa;Accusantium enim eveniet, Autem consequatur facilis voluptatem quidem, Beatae quam, Commodi quidem sequi ipsum at, Cupiditate totam impedit quam, Dolore, Dolore nemo aperiam, Est veniam quam ullam, Eveniet, Hic, Impedit debitis ipsam autem autem delectus facere quis, Laborum dolores blanditiis autem, Magni iste, Maxime ipsam error nesciunt animi, Molestiae eveniet quisquam mollitia, Nam, Nostrum ab amet sed sit debitis aspernatur, Perferendis qui quam at commodi perferendis accusantium hic, Possimus necessitatibus optio reiciendis nemo sunt architecto dolor sunt, Ratione et amet dignissimos, Recusandae, Repudiandae, Repudiandae quibusdam eveniet possimus ducimus magni, Sunt fuga doloribus, Tenetur doloribus laboriosam, Velit
Maria Cecília Azevedo;Alias deserunt a beatae commodi optio, Amet aspernatur nisi consequuntur enim, At ratione, Distinctio, Dolorem cumque veritatis at voluptatibus, Dolores, Dolores quia ut perferendis, Dolorum quasi alias possimus, Ducimus, Eos earum, Esse, Fugit eveniet ea tempore cumque officiis earum, In perferendis sunt harum dolor natus, In praesentium unde, In repudiandae provident quia veniam repudiandae accusamus deleniti, Magni corrupti quos porro enim asperiores, Mollitia, Mollitia modi, Neque labore iure excepturi, Nobis, Non vero, Officiis magnam labore vitae, Pariatur, Perferendis incidunt molestias, Reprehenderit iste facilis, Sapiente repudiandae soluta fugit esse reprehenderit blanditiis, Tempora blanditiis repudiandae eos sapiente saepe fugit, Unde aliquam, Voluptatum dolores quis
Maria Cecília Lima;Accusantium vitae nemo architecto laboriosam debitis, Amet maiores similique, Animi inventore ab, Consequuntur, Doloremque excepturi, Eaque quam assumenda voluptas nulla inventore, Esse doloremque qui consectetur rem tempora hic, Illo at itaque quisquam quisquam quae, Iste, Itaque architecto beatae, Libero laborum explicabo quam placeat, Maiores cum, Mollitia, Occaecati, Odio culpa velit inventore asperiores culpa, Praesentium aut, Quia facere corporis ipsum laborum nesciunt, Sapiente quas ad unde doloremque est quibusdam, Sed occaecati nisi sit exercitationem vel voluptas corrupti, Sit omnis culpa consequuntur quis, Tempora, Veniam vel perspiciatis hic delectus in
Maria Clara Ramos;Adipisci aut, Commodi, Dolores, Dolorum deserunt voluptatum accusantium, Excepturi sint voluptates quod ut, Exercitationem, Explicabo vero error pariatur, Id dolor deleniti non illo, Maxime corrupti unde commodi, Molestias hic unde mollitia, Nesciunt vero, Nobis dolorem ratione ducimus minus vel recusandae, Sapiente repudiandae, Sed delectus doloremque molestias, Soluta quia dolor, Suscipit corporis itaque, Suscipit delectus magnam cum nesciunt adipisci earum enim, Ut nisi, Vel, Vel, Veniam laborum, Voluptate, Voluptatibus nemo totam eaque perferendis eaque omnis
Maria Eduarda Barbosa;Amet nam, Aperiam, Assumenda placeat rerum nulla praesentium magnam molestiae molestiae, Corrupti, Corrupti, Dicta accusamus modi quam nesciunt, Eum, Facere necessitatibus ducimus natus eveniet, Fuga, Iste dicta officiis minus, Natus, Non rem, Perspiciatis, Perspiciatis, Possimus, Possimus illo praesentium repudiandae officia, Praesentium reprehenderit, Quam, Quis, Sit, Tempora, Vel
Maria Eduarda Nogueira;Ab quisquam ut quos atque, Ad nostrum molestias iusto explicabo, Asperiores, Ea blanditiis non maiores, Eveniet necessitatibus optio corrupti, Fugit qui itaque, In distinctio, Minus explicabo quos, Nam odio, Nesciunt inventore perferendis dolores iure reprehenderit magni quis, Nulla amet sint mollitia, Quidem officia possimus ducimus consequuntur deleniti, Quod nobis maxime nihil temporibus, Rerum dolorum aspernatur amet totam blanditiis quaerat dicta, Sed asperiores voluptatibus repudiandae recusandae repellendus, Suscipit, Velit, Voluptas ab aliquam optio tempore, Voluptatibus praesentium expedita vitae nisi suscipit
Maria Fernanda Ferreira;A veniam consequuntur quidem suscipit, At tenetur, Autem, Beatae veritatis, Consequatur ducimus excepturi asperiores molestiae, Dolorum, Esse at amet omnis perferendis sed amet, Exercitationem, Fuga impedit, Illo, In corrupti voluptate, Labore, Labore, Libero laborum at, Minus ipsa nemo aliquid, Mollitia hic pariatur, Nemo est voluptatum voluptas, Nobis beatae, Nulla alias fugiat sit dolorem aspernatur, Odio debitis perferendis reiciendis, Omnis, Omnis cum, Perspiciatis deleniti, Provident cupiditate id provident, Quam, Quidem, Quis eos, Quisquam accusamus dicta, Quos aperiam mollitia sunt, Quos rem architecto veniam vitae, Repudiandae, Tempora ratione quis ut commodi, Totam laudantium facere dolore, Ullam magnam enim laudantium ad beatae dicta, Unde qui totam doloribus aperiam, Vero reiciendis repellendus explicabo maiores accusamus exercitationem, Voluptates magni facilis, Voluptates vel incidunt
Maria Julia Aragão;Ab quod, Alias tempore quaerat quod, Consectetur autem amet aperiam officiis, Culpa ab, Cupiditate nisi atque facilis eius, Debitis, Delectus, Doloribus quia assumenda necessitatibus, Error temporibus, Excepturi, Hic assumenda ratione dolore, Impedit voluptatibus ratione, Incidunt nulla, Maxime, Nostrum deleniti sunt amet sunt unde a, Optio eos, Perspiciatis deleniti, Quis earum illo iusto dolorem suscipit veritatis, Sequi praesentium, Tempora repellat corrupti dolores, Velit aliquam velit neque dolorem voluptate, Vitae dolor, Voluptatum amet dolorum
Maria Julia Castro;Ab quisquam ut quos atque, Adipisci atque laborum, Animi quisquam ducimus iste, Architecto aperiam, Aspernatur, Assumenda harum rem vel expedita nulla adipisci reiciendis incidunt, At ipsam esse iure ad similique, Cum, Cupiditate, Eius modi reiciendis vel consequuntur, Eligendi, Eos, Eos beatae, Eum quibusdam veritatis repudiandae perferendis quos, Facere necessitatibus ducimus natus eveniet, Fugiat, Fugit nemo, Id veritatis est voluptates, Impedit, Iste qui deleniti perferendis dolorum totam, Itaque praesentium ab, Laboriosam quisquam adipisci pariatur cum quidem, Laudantium ullam aliquam soluta perspiciatis provident, Maiores magni labore dolores saepe culpa, Necessitatibus neque voluptate magnam quaerat nisi inventore, Neque commodi officiis, Nihil iusto, Nisi aliquam eaque autem quas iusto, Praesentium aut, Praesentium perferendis tempore voluptates repudiandae repellat ad, Quam dolore quos, Quasi ipsam cum, Quibusdam excepturi, Sunt laborum, Totam voluptatum velit sint similique, Veniam autem cumque, Voluptatem officiis eos iste culpa
Maria Luiza Silva;Adipisci non distinctio nostrum, Aspernatur, Autem ab amet fugit, Beatae ab id in, Corporis molestiae, Cum, Earum quae corporis ut cupiditate possimus, Eveniet, Excepturi quisquam, Expedita quod porro possimus laboriosam, Facere, Facilis alias magnam voluptates, Inventore, Itaque, Itaque sapiente adipisci debitis dicta ducimus, Iusto libero hic corporis minima optio, Laudantium, Magni laboriosam assumenda, Molestias minima, Mollitia perferendis dignissimos in temporibus, Provident illum tenetur natus voluptas porro, Quasi in incidunt laudantium laboriosam, Quisquam accusantium ad aut maxime veritatis, Quod quibusdam, Sapiente numquam ea rem, Soluta itaque veniam fugit cumque provident natus, Tenetur placeat libero ratione sit consequatur, Tenetur praesentium
Maria Vieira;Amet blanditiis rerum veniam, Architecto voluptas atque, Asperiores libero quo voluptas facere fugiat, Delectus consequuntur dignissimos, Dicta, Dolor accusamus, Ducimus voluptatibus, Eius porro distinctio molestias, Eos, Eum totam dolorum architecto assumenda maiores doloribus sequi at, Excepturi doloremque, Fuga ex repudiandae omnis possimus placeat a modi, Hic impedit distinctio architecto, Ipsa accusantium aspernatur libero, Labore doloribus voluptatum quibusdam, Labore possimus, Molestiae, Occaecati impedit quos ab maiores fugit tenetur, Quae laboriosam inventore, Quidem nihil animi qui quibusdam, Quos eius unde error voluptate in nisi, Saepe enim similique quod inventore nulla, Sapiente, Soluta ipsa, Temporibus libero, Voluptatibus eius molestiae iure exercitationem voluptatem voluptatum quos
Maria Vitória Oliveira;Ab, Accusantium sapiente, Atque architecto, Beatae veritatis pariatur fuga tenetur, Dicta, Dolor, Eaque, Eum quibusdam veritatis repudiandae perferendis quos, Illum dolorem numquam soluta corrupti quasi, Molestias culpa ea alias, Nam aliquam repellendus in dolores recusandae nulla repellendus, Nulla, Officia, Perferendis, Quae placeat, Quam, Quia officiis ut quasi ea qui accusantium quos nobis, Quod, Sapiente magnam quibusdam sequi eum dicta ipsam, Tempore id odit perspiciatis ducimus, Voluptates facilis
Mariana Cardoso;Autem error numquam facilis omnis mollitia delectus commodi, Dolorem architecto, Esse maxime id expedita placeat, Nam qui mollitia facere beatae, Nobis rerum ab aut illo est excepturi dolore est, Nulla aut totam cupiditate ab quos, Optio, Praesentium, Quam facilis numquam, Quidem a maxime officia, Quis perspiciatis sint temporibus aliquam aut, Reiciendis, Saepe repudiandae vero ipsa, Tenetur itaque dolores necessitatibus quibusdam nihil
Mariana da Cruz;Ab, Alias ratione, Aspernatur ipsam vitae placeat, Assumenda vero consequuntur placeat dolorem adipisci ex, Cumque debitis occaecati nostrum, Delectus ut eos, Doloribus, Dolorum maxime, Eligendi voluptates rem error, Eum, Excepturi odit odio beatae, Harum nesciunt, Id tempora officiis soluta doloribus, Magni assumenda, Mollitia sunt beatae ipsum harum, Quasi quis, Qui dicta totam ad facere, Temporibus, Tenetur nam repellendus
Mariane Pires;Accusamus omnis vero tenetur ullam rerum, Alias repellat odio, Corrupti, Cum explicabo accusamus odio reiciendis, Cupiditate natus, Cupiditate quos magnam aut rem assumenda nihil dolore, Ea, Earum asperiores, Enim iste quam, Esse quasi natus, Exercitationem ipsam debitis, Facere reiciendis voluptatum neque ea velit, Hic exercitationem modi nemo molestiae ratione saepe quam aliquam, Illum aliquam vitae, Ipsum, Iure, Modi, Nam velit, Occaecati possimus iusto earum enim, Perspiciatis, Perspiciatis, Qui aspernatur eligendi laudantium ab commodi, Sit, Soluta aperiam consectetur
Marina Lopes;Asperiores aperiam nam ut atque dolores vero blanditiis, At nam earum voluptatum, Beatae aperiam at doloremque ratione voluptatibus, Consequuntur, Dolores assumenda voluptatum iste quaerat, Dolorum temporibus a sunt accusantium, Ducimus voluptate deleniti illo numquam atque, Eius, Est doloribus animi necessitatibus excepturi nobis dicta magni occaecati, Excepturi minus, Illum omnis, Libero eaque sint et, Nulla alias, Officia, Omnis dignissimos eaque dolorem numquam laboriosam, Quibusdam, Ratione vitae vitae est consectetur enim, Reiciendis omnis, Rem aliquid, Repellendus ea eligendi, Reprehenderit tenetur, Tenetur fugit neque quisquam veniam ullam quasi, Voluptate maxime voluptatum ad
Marina Teixeira;A ab tempore voluptatem voluptatibus, Adipisci reprehenderit, Adipisci tempora natus soluta mollitia, Aliquid temporibus, Consequuntur fugiat modi nesciunt, Dolorum, Et, Itaque, Magnam aperiam vitae quis est, Magni repellat ad aperiam nobis, Nobis laboriosam ratione aliquid, Pariatur deserunt expedita rem ex aperiam magni, Praesentium quibusdam rerum tempore, Quidem quas commodi atque praesentium, Quis, Ratione minima voluptas incidunt consequatur reiciendis delectus, Repellendus adipisci voluptates inventore, Sequi, Vitae libero, Voluptas eius, Voluptate
Matheus Azevedo;Aut totam et veniam assumenda numquam, Eum, Ipsum repudiandae a autem modi, Laudantium non suscipit magnam aperiam occaecati quod, Natus eos assumenda nesciunt reiciendis, Nemo, Neque at dolores quidem, Quam quae tempore, Rerum quia exercitationem maiores vero ab praesentium id, Sint nesciunt cum exercitationem nulla ad, Temporibus, Ullam magni sapiente optio, Vitae natus quisquam, Voluptates, Voluptatum nostrum asperiores animi sit
Maysa Costela;Accusantium, Accusantium magnam ratione quae aliquid illo esse aliquam, Amet inventore perferendis qui expedita ab, Dolor error iste perferendis nemo, Eaque est veritatis, Est vel quaerat magnam, Et accusantium quae dolor, Excepturi sapiente nihil dolores dicta, Ipsa aspernatur rem necessitatibus, Maxime saepe unde, Minima atque, Necessitatibus, Necessitatibus neque voluptate magnam quaerat nisi inventore, Nesciunt nihil pariatur, Pariatur ipsum odio amet dolor quibusdam laudantium praesentium, Temporibus, Voluptatum voluptatum sequi illo necessitatibus
Maysa Freitas;Accusamus molestias maiores possimus nostrum eaque eos distinctio esse, Animi, Animi laboriosam quibusdam maxime error, Debitis culpa, Debitis magni, Debitis voluptates quam deserunt ex pariatur odit illum, Distinctio accusamus mollitia nulla autem quo tempore laboriosam, Dolore nemo aperiam praesentium officiis, Dolores ut tempore nemo labore, Est maxime in perspiciatis, Et suscipit dicta, Ex aliquid natus omnis in aut perspiciatis, Explicabo omnis modi sequi repudiandae hic libero, Fuga ipsum quae officia voluptate, Ipsa impedit deleniti sit, Necessitatibus, Necessitatibus ducimus ratione magnam, Neque minus facere omnis vero voluptatem similique, Quibusdam dolorem ducimus dolor ipsa, Ratione assumenda, Sapiente, Ut, Veritatis aliquam optio quod sapiente reiciendis
Miguel Pereira;A, Autem quisquam, Consequuntur dolore commodi ex, Cumque dolor eius ipsam quas cum, Delectus reiciendis voluptatibus necessitatibus deleniti reiciendis veniam laboriosam, Enim, Eos minus quam tenetur error quam dolor, Eos quam autem quis commodi, Illo quod quibusdam officia placeat, Illum sit est et sed voluptate, Itaque atque itaque hic perferendis, Laudantium dolor sit repellendus cumque, Magni saepe sequi fugit qui, Molestias hic unde mollitia, Nam fugiat velit quia ducimus, Praesentium aliquam blanditiis quidem, Quis eum, Sunt nulla quis, Tempore nam assumenda dicta, Tenetur, Velit, Velit deserunt dolorem perspiciatis unde aut, Vitae, Voluptatum
Milena da Mata;Accusantium, Corporis iure facere distinctio, Dicta esse sunt aliquam, Earum quisquam, Facilis aspernatur sit praesentium autem laborum praesentium, Itaque quia ipsam culpa, Labore repellat laborum, Occaecati voluptates, Possimus aut alias dolore rem veritatis beatae eum, Quaerat similique, Quibusdam blanditiis quod dolorem itaque, Quidem, Quisquam labore, Quos omnis voluptas assumenda doloribus aperiam, Recusandae incidunt, Sed modi deleniti beatae, Sunt
Mirella Cardoso;Accusamus quis dicta, Aperiam odit molestiae, Atque assumenda eum dolorem, Consectetur facilis, Consequatur, Doloribus distinctio perspiciatis nostrum, Dolorum, Eveniet rerum optio, Harum labore similique ex quis omnis, Id eligendi ea at maiores consectetur aut est, Ipsam voluptatum consectetur delectus, Magnam ad ipsum impedit eum, Natus eos assumenda nesciunt reiciendis, Optio sint recusandae quis, Perspiciatis doloribus sit qui, Quibusdam, Quos eius unde error voluptate in nisi, Rem esse, Soluta quod numquam corporis, Tempore, Vero quas itaque recusandae tenetur consequuntur deserunt, Vitae fugiat unde voluptates culpa, Voluptas aliquid nobis
Mirella da Cunha;A tenetur, Aperiam, Aspernatur autem, Corrupti laudantium illum eligendi, Ducimus eum culpa vitae ut praesentium magni expedita atque, Error sint dolor corrupti quidem itaque sit corporis porro, Ex, Facilis repellat a veritatis veniam porro, Incidunt eaque veniam, Incidunt tempora quod eligendi, Inventore perferendis repellat, Minima, Minima dolor excepturi, Nam, Natus ab consequuntur vitae voluptatem recusandae modi, Necessitatibus, Nisi, Nisi neque, Perferendis, Quia harum, Quia molestias deserunt repudiandae, Quisquam fugiat, Sed nulla dolorem saepe reiciendis nemo quia, Ut ipsam facilis, Voluptates, Voluptatibus
Mirella Peixoto;Aliquam, Aliquid, Aliquid nam nesciunt earum maxime, Aut, Eius, Et, Expedita, Iste facere nisi adipisci soluta dignissimos voluptates, Itaque dolores porro labore, Iure ad explicabo sit beatae ipsam eum hic, Magni impedit, Maxime saepe unde, Minima mollitia soluta occaecati, Perspiciatis neque nam occaecati ut, Quasi pariatur soluta, Quibusdam magnam, Quod, Temporibus, Voluptate cum reprehenderit optio et dolores
Mirella Vieira;Ab laboriosam, Amet commodi, Aperiam, Blanditiis, Consequuntur laudantium quos corporis ut saepe quos, Culpa maxime necessitatibus quidem reprehenderit, Delectus natus, Deleniti quis quae harum enim fuga, Doloremque, Eius neque ad, Eligendi enim labore mollitia incidunt quasi exercitationem, Eos nulla cupiditate placeat officiis, Eveniet laboriosam, Fugiat quidem, Harum, Id facere ullam ipsa, Illum occaecati, Laboriosam nam suscipit perspiciatis quis, Maiores veritatis quas nobis, Minima expedita, Minus blanditiis tempora, Nobis repellendus unde, Nostrum adipisci laudantium iure, Nulla, Repellat labore
Murilo Rodrigues;A ab tempore voluptatem voluptatibus, A dignissimos odio ea tempore eius, Ab, Aperiam dolor, Aut, Corrupti, Cumque nobis cumque rem quos cumque ipsa, Cupiditate, Dolor, Doloremque rerum, Eius mollitia quidem, Eum voluptatibus sunt delectus, Fuga, Harum doloremque, Illo nobis provident veritatis, Incidunt, Natus impedit atque placeat, Nemo itaque, Numquam, Provident reprehenderit cum, Repellendus ea eligendi, Reprehenderit reprehenderit, Sed asperiores voluptatibus repudiandae recusandae repellendus, Unde dolor, Voluptate
Murilo Viana;Aperiam rerum omnis voluptas rerum eius corporis sit numquam, Atque assumenda eum dolorem, Deserunt vitae reiciendis dolor nulla assumenda, Dicta temporibus possimus, Dignissimos optio hic molestias libero perferendis, Ea vero numquam, Enim assumenda vel, Exercitationem corporis delectus sequi, Explicabo consectetur ex inventore ipsa eaque, Ipsum doloremque, Maxime, Mollitia, Necessitatibus, Nisi aut, Optio harum vitae hic numquam, Pariatur eius sit quod, Praesentium aut, Quae quidem, Quibusdam explicabo quisquam ad, Saepe expedita aspernatur, Sapiente explicabo, Suscipit assumenda inventore enim facere, Suscipit inventore nam maxime, Tempora, Veritatis mollitia distinctio architecto modi necessitatibus cumque beatae mollitia, Voluptas, Voluptatibus recusandae a et natus earum
